Name,SalePrice,DateOfSale,Year,Mileage,Classification,Transmission,FuelType,Description,SaleLocation
audi q7 (tdi v6),41241,03/01/2024,2019,29431,suv,automatic,diesel,red audi q7. s line 50 tdi quattro 286 ps tiptronic 3.0 5dr,wexford
audi tts (limited edition),18635,06/01/2024,2014,46283,convertible,automatic,petrol,red audi tts. 2.0 tfsi limited edition roadster s tronic quattro euro 5 2dr,carlow
audi s4 (tdi v6),37132.00,06/01/2024,2019,34976,saloon,automatic,diesel,audi a4. s4 black edition 3.0 4dr,dublin
audi a6 saloon (s line),31521.00,2024-01-08,2020,26639,saloon,automatic,diesel,blue audi a6 diesel saloon. 40 tdi quattro s line 4dr s tronic 2.0. 1 previous owner,westmeath
audi rs6 avant (tfsi v8),107264.00,09/01/2024,2021,4247,estate,automatic,petrol,audi rs6. rs 6 avant vorsprung 600 ps tiptronic 4.0 5dr. 1 previous owner,kilkenny
audi a6 avant (ultra),16885.00,09/01/2024,2015,80582,estate,automatic,diesel,black audi a6 avant. 2.0 tdi ultra black edition s tronic euro 6 (s/s) 5dr. 2 previous owners,dublin
audi a4 (tdi),22119.00,09/01/2024,2019,17572,saloon,automatic,diesel,audi a4. sport 35 tdi 150 ps s tronic 2.0 4dr,dublin
audi q7 (s line),32190.00,2024-01-12,2017,60246,suv,automatic,diesel,black audi q7. 3.0 tdi v6 s line tiptronic quattro euro 6 (s/s) 5dr. 2 previous owners,kerry
audi q3 (s line edition),21839.00,13/01/2024,2017,46462,suv,automatic,petrol,blue audi q3. 1.4 tfsi cod s line edition s tronic euro 6 (s/s) 5dr. 2 previous owners,dublin
audi q3 (cod),26266.00,14/01/2024,2019,46443,suv,automatic,petrol,black audi q3. sport 35 tfsi 150 ps s tronic 1.5 5dr,meath
audi a3 (tdi),6568.00,2024-01-16,2011,99731,hatchback,manual,diesel,blue audi a3. 2.0 tdi black edition sportback euro 5 (s/s) 5dr. 2 previous owners,meath
audi q2 (sport),24845.00,16/01/2024,2021,14696,suv,manual,petrol,silver audi q2. sport 30 tfsi 110 ps 6-speed 1.0 5dr,donegal
audi q2 (tfsi),19550.00,17/01/2024,2017,44405,suv,automatic,petrol,grey audi q2. 1.4 tfsi cod s line suv 5dr petrol s tronic euro 6 (s/s) (150 ps). 2 previous owners,dublin
audi q5 (s line plus),20116.00,17/01/2024,2015,57248,suv,automatic,diesel,audi q5. 3.0 tdi v6 s line plus s tronic quattro euro 6 (s/s) 5dr. 2 previous owners,limerick
audi q3 (tfsi),19164.00,2024-01-17,2017,40082,suv,manual,petrol,navy audi q3. 1.4t fsi s line edition 5dr,offaly
audi a3 (cod),16249.00,18/01/2024,2017,41345,hatchback,manual,petrol,silver audi a3. a3 1.5 tfsi cod black edition (s/s) 3dr,dublin
audi q3 (s line plus),12747.00,18/01/2024,2014,83377,suv,automatic,diesel,grey audi q3. 2.0 tdi s line plus s tronic quattro euro 5 (s/s) 5dr. 4 previous owners,dublin
audi a4 allroad (sport),17974,19/01/2024,2017,93358,estate,automatic,diesel,red audi a4 allroad. 2.0 tdi sport s tronic quattro euro 6 (s/s) 5dr. 3 previous owners,roscommon
audi q3 (cod),18829.00,19/01/2024,2017,6981,suv,manual,petrol,blue audi q3. 1.4t fsi sport 5dr satellite navigation,dublin
audi a5 (tfsi),29216.00,2024-01-20,2019,28606,coupe,automatic,petrol,red audi a5. 45 tfsi quattro black edition 2dr s tronic [tech] 2.0,clare
audi e-tron (technik),43866,21/01/2024,2020,17091,suv,automatic,electric,grey audi e-tron. 230kw 50 quattro 71kwh technik 5dr auto. 1 previous owner,kerry
audi q2 (s line),19947.00,22/01/2024,2017,26332,suv,automatic,petrol,blue audi q2. 1.4 tfsi s line 5dr s tronic,dublin
audi q2 (tdi),37468.00,2024-01-22,2022,8561,suv,automatic,diesel,grey audi q2 diesel estate. 35 tdi quattro black edition 5dr s tronic 2.0. 1 previous owner,dublin
audi a4 (tdi),14241.00,2024-01-22,2016,54745,saloon,manual,diesel,silver audi a4. 2.0 tdi ultra se 4d 148 bhp ****uk delivery available****. 2 previous owners,waterford
audi a5 (tdi),17714.00,25/01/2024,2016,54916,hatchback,automatic,diesel,red audi a5. 2.0 tdi black edition plus sportback multitronic (s/s) 5dr,westmeath
audi a3 (tdi),5121.00,26/01/2024,2012,142867,hatchback,automatic,diesel,grey audi a3. 2.0 tdi sport sportback s tronic euro 5 (s/s) 5dr. 3 previous owners,dublin
audi a7 (s line),18430.00,2024-01-26,2014,82331,hatchback,automatic,petrol,red audi a7. 3.0 tfsi v6 s line sportback s tronic quattro euro 5 (s/s) 5dr. 1 previous owner,cork
audi a4 avant (sport),11656.00,26/01/2024,2017,92247,estate,manual,diesel,blue audi a4 avant. 2.0 tdi ultra sport euro 6 (s/s) 5dr. 2 previous owners,donegal
audi a4 avant (s line),16363.00,27/01/2024,2014,31357,estate,automatic,diesel,black audi a4. 2.0 avant tdi s line start/stop 5d 148 bhp. 2 previous owners,cork
audi q5 (s line),29883.00,28/01/2024,2018,40621,suv,automatic,petrol,red audi q5. 2.0 tfsi quattro s line 5d 248 bhp finance from 7.9% apr,galway
audi rsq8 (tfsi v8),100316.00,29/01/2024,2020,49961,suv,automatic,petrol,navy audi rsq8. 4.0 tfsi v8 vorsprung tiptronic quattro euro 6 (s/s) 5dr. 1 previous owner,meath
audi e-tron (technik),43234.00,2024-01-30,2020,19925,suv,automatic,electric,black audi e-tron. 230kw 50 quattro 71kwh technik 5dr auto,galway
audi a5 cabriolet (edition 1),41524.00,30/01/2024,2021,2032,convertible,automatic,petrol,audi a5 cabriolet. 2.0 tfsi 40 edition 1 s tronic euro 6 (s/s) 2dr. 1 previous owner,dublin
audi a3 (se),12865,31/01/2024,2017,36885,hatchback,manual,petrol,black audi a3. 1.0 tfsi se sportback euro 6 (s/s) 5dr. 2 previous owners,offaly
audi q3 (cod),34512.00,31/01/2024,2020,19789,suv,automatic,petrol,audi q3. 1.5 tfsi cod 35 s line sportback 5dr petrol s tronic euro 6 (s/s) (150 ps). 1 previous owner,carlow
audi a1 (sport),13944.00,02/02/2024,2013,6690,hatchback,automatic,petrol,blue audi a1. 1.4 tfsi sport s tronic euro 5 (s/s) 3dr. 1 previous owner,dublin
audi a3 (tfsi),17882.00,02/02/2024,2018,38362,hatchback,manual,petrol,blue audi a3. 1.5 tfsi black edition 5dr satellite navigation,dublin
audi a6 avant (tdi),9134.00,03/02/2024,2012,119002,estate,manual,diesel,audi a6 avant. 2.0 tdi s line euro 5 (s/s) 5dr,dublin
audi tts (tfsi),10849.00,05/02/2024,2008,81434,coupe,automatic,petrol,blue audi tts. 2.0 tfsi coupe 3dr petrol s tronic quattro euro 4 (272 ps). 3 previous owners,laois
audi a5 (sport),21170.00,08/02/2024,2017,8676,hatchback,automatic,diesel,grey audi a5. 2.0 tdi sport sportback 5dr diesel s tronic quattro euro 6 (s/s) (190 ps). 1 previous owner,dublin
audi a3 (tfsi),9107.00,08/02/2024,2013,63149,hatchback,manual,petrol,blue audi a3. 1.4 tfsi sport 3dr. 3 previous owners,dublin
audi a5 (s line),22127.00,11/02/2024,2017,34470,coupe,automatic,petrol,black audi a5. 2.0 t fsi quattro s line 252ps coupe automatic sat nav 2dr. 1 previous owner,dublin
audi q2 (tdi),22642.00,12/02/2024,2017,31468,suv,automatic,diesel,blue audi q2. 2.0 tdi s line suv 5dr diesel s tronic quattro euro 6 (s/s) (150 ps). 4 previous owners,louth
audi a4 (se),12648.00,12/02/2024,2018,97758,saloon,automatic,diesel,red audi a4. 2.0 tdi ultra se 4d 148 bhp. 1 previous owner,kerry
audi a1 (sport),10867.00,13/02/2024,2014,32445,hatchback,manual,petrol,"grey audi a1. 1.4 sportback tfsi sport 5d 122 bhp buy online+sport seats+6.5"" display. 2 previous owners",kerry
audi a1 (tdi),12470.00,14/02/2024,2015,30884,hatchback,manual,diesel,blue audi a1. 1.6 tdi s line 3d 114 bhp. 2 previous owners,donegal
audi a5 (tdi),8827.00,14/02/2024,2013,108733,hatchback,automatic,diesel,audi a5. 2.0 tdi black edition sportback multitronic euro 5 (s/s) 5dr. 3 previous owners,limerick
audi tt (black edition),15692.00,15/02/2024,2014,35999,coupe,manual,diesel,black audi tt. audi tt coupe 2.0 tdi 170 quattro black edition 2dr 19in alloys bose surround sound. 3 previous owners,dublin
audi a5 (black edition),14284.00,17/02/2024,2014,92154,hatchback,automatic,diesel,red audi a5. 3.0 tdi v6 black edition sportback multitronic euro 5 (s/s) 5dr. 3 previous owners,louth
audi q2 (technik),19726.00,2024-02-20,2020,37950,suv,manual,diesel,red audi q2. technik 30 tdi 116 ps 6-speed 1.6 5dr,cork
audi a1 (sport),12355.00,20/02/2024,2015,51282,hatchback,manual,diesel,silver audi a1. 1.6 tdi sport 5dr,dublin
audi a1 (s line),7122.00,22/02/2024,2012,65995,hatchback,manual,diesel,red audi a1. 1.6 tdi s line euro 5 (s/s) 3dr,tipperary
audi a6 avant (tfsi),46626.00,23/02/2024,2022,498,estate,automatic,petrol,blue audi a6. 40 tfsi black edition 5dr s tronic [c+s pack] 2.0. 1 previous owner,dublin
audi q5 (tdi),16291.00,24/02/2024,2015,80042,suv,automatic,diesel,audi q5. 2.0 tdi s line plus s tronic quattro euro 5 (s/s) 5dr. 3 previous owners,donegal
audi a6 avant (tdi v6),10878.00,26/02/2024,2013,122741,estate,automatic,diesel,"navy audi a6 avant. 3.0 tdi v6 s line estate 5dr diesel multitronic (136 g/km, 215 bhp). 2 previous owners",cork
audi a3 (tdi),4709.00,2024-02-26,2011,99282,hatchback,manual,diesel,black audi a3. 1.6 tdi sportback euro 5 (s/s) 5dr. 2 previous owners,dublin
audi tt (tfsi v6),4936.00,2024-02-26,2014,146153,coupe,automatic,petrol,audi tt. 3.2 tfsi v6 s tronic quattro euro 4 3dr. 3 previous owners,dublin
audi a3 (sport),9888.00,27/02/2024,2015,77289,hatchback,manual,petrol,blue audi a3. 1.4 tfsi sport sportback euro 6 (s/s) 5dr (nav). 1 previous owner,tipperary
audi a4 (s line),10127.00,27/02/2024,2014,60004,saloon,manual,diesel,audi a4. 2.0 tdi s line saloon 4dr diesel manual euro 5 (s/s) (150 ps). 2 previous owners,wexford
audi a8 (sport executive),18067.00,27/02/2024,2015,105333,saloon,automatic,diesel,blue audi a8. 3.0 tdi v6 sport executive tiptronic quattro 4dr lwb,dublin
audi q7 (tdicd v6),18286.00,2024-02-28,2012,96585,suv,automatic,diesel,audi q7. 3.0 tdicd v6 s line plus tiptronic quattro euro 6 (s/s) 5dr. 2 previous owners,dublin
audi a4 (sport edition),28059.00,28/02/2024,2021,10607,saloon,automatic,diesel,red audi a4 diesel saloon. 30 tdi sport edition 4dr s tronic 2.0. 1 previous owner,kerry
audi a3 (tdi),9466,28/02/2024,2016,94870,hatchback,manual,diesel,audi a3. tdi ultra se technik hatchback 1.6 manual diesel 5dr. 2 previous owners,dublin
audi a3 (tdi),6159.00,29/02/2024,2012,80190,hatchback,manual,diesel,grey audi a3. 1.6 tdi sport sportback euro 5 (s/s) 5dr,cavan
audi q3 (se),14833.00,29/02/2024,2014,55508,suv,automatic,petrol,red audi q3. 2.0 tfsi se suv 5dr petrol s tronic quattro euro 5 (s/s) (170 ps). 2 previous owners,louth
audi a4 (s line),11684.00,01/03/2024,2012,60005,saloon,manual,petrol,black audi a4. 1.8 tfsi s line 4dr. 3 previous owners,limerick
audi q3 (tdi),18644.00,01/03/2024,2017,62319,suv,manual,diesel,black audi q3. 2.0 tdi quattro black edition 5d 182 bhp. 2 previous owners,dublin
audi a3 (technik se),3951.00,01/03/2024,2010,141676,hatchback,manual,petrol,blue audi a3. 1.6 technik se sportback 5dr petrol manual euro 4 (102 ps). 1 previous owner,cork
audi a4 avant (black edition),8796.00,01/03/2024,2011,100072,estate,manual,diesel,grey audi a4 avant. 2.0 tdi black edition 5dr. 3 previous owners,mayo
audi a3 cabriolet (tfsi),6097.00,2024-03-03,2009,80457,convertible,automatic,petrol,navy audi a3 cabriolet. 1.8 tfsi sport s tronic euro 4 2dr,galway
audi q3 (tdi),26840.00,2024-03-04,2019,47958,suv,automatic,diesel,silver audi q3. s line 35 tdi 150 ps s tronic 2.0 5dr. 2 previous owners,galway
audi a6 avant (le mans),5867.00,05/03/2024,2010,149856,estate,automatic,diesel,silver audi a6 avant. 3.0 tdi v6 le mans tiptronic quattro euro 5 5dr. 3 previous owners,cork
audi q7 (tdi v6),7255.00,2024-03-06,2009,103330,suv,automatic,diesel,grey audi q7. 3.0 tdi v6 se tiptronic quattro euro 4 5dr. 2 previous owners,galway
audi a4 avant (tdi),30366.00,06/03/2024,2021,13276,estate,automatic,diesel,blue audi a4 avant. 2.0 tdi 35 s line s tronic euro 6 (s/s) 5dr. 2 previous owners,waterford
audi a1 (sport),11047.00,07/03/2024,2015,43525,hatchback,manual,petrol,red audi a1. 1.0 tfsi sport 5dr. 2 previous owners,dublin
audi q5 (competition),51989.00,08/03/2024,2021,18129,suv,automatic,petrol plug-in hybrid,blue audi q5. sportback competition 55 tfsi e quattro 367 ps s tronic 2.0 5dr. 1 previous owner,cork
audi q2 (black edition),36610.00,08/03/2024,2022,3441,suv,automatic,diesel,black audi q2. 35 tdi quattro black edition 5dr s tronic 2.0. 1 previous owner,dublin
audi a6 avant (se),11114.00,11/03/2024,2015,105530,estate,manual,diesel,blue audi a6 avant. 2.0 tdi ultra se euro 6 (s/s) 5dr,kerry
audi a1 (tfsi),7892.00,13/03/2024,2013,67487,hatchback,manual,petrol,blue audi a1. 1.4 tfsi sport 3dr. 4 previous owners,kildare
audi a4 (tdi),10335.00,13/03/2024,2015,111800,saloon,manual,diesel,audi a4. 2.0 tdi ultra se technik euro 6 (s/s) 4dr. 1 previous owner,kildare
audi a3 (tfsi),12230.00,13/03/2024,2015,56428,hatchback,manual,petrol,red audi a3. 1.4 tfsi cod s line hatchback 3dr petrol manual euro 6 (s/s) (150 ps). 2 previous owners,roscommon
audi a1 (tfsi),7303.00,2024-03-13,2012,75444,hatchback,manual,petrol,navy audi a1. 1.4 tfsi sport 3d 122 bhp *fsh *zero depo finance *bluetooth,dublin
audi a6 avant (s line),11258.00,14/03/2024,2013,98908,estate,automatic,diesel,silver audi a6 avant. 2.0 tdi s line multitronic euro 5 (s/s) 5dr. 2 previous owners,kerry
audi q4 e-tron (s line),54413.00,14/03/2024,2021,9613,suv,automatic,electric,"red audi q4 e-tron. q4 s line 35 e-tron 125,00 kw 5dr. 2 previous owners",dublin
audi a6 saloon (tdi),27705.00,2024-03-16,2019,27032,saloon,automatic,diesel,black audi a6. 40 tdi s line 4dr s tronic 2.0. 1 previous owner,dublin
audi a5 (tfsi),27293.00,17/03/2024,2019,25204,coupe,automatic,petrol,navy audi a5. coup- black edition 40 tfsi 190 ps s tronic 2.0 2dr. 2 previous owners,dublin
audi a5 cabriolet (tdi),9267,17/03/2024,2013,129480,convertible,auto,diesel,grey audi a5 cabriolet. 2.0 tdi s line special edition multitronic euro 5 (s/s) 2dr. 3 previous owners,donegal
audi a4 avant (ultra),12003.00,2024-03-18,2016,93156,estat,manual,diesel,navy audi a4 avant. 2.0 tdi ultra se euro 6 (s/s) 5dr. 2 previous owners,dublin
audi s3 (black edition),26107,19/03/2024,2018,53289,hatchback,automatic,petrol,blue audi a3. s3 tfsi 300 quattro black edition 5dr s tronic 2.0. 2 previous owners,galway
audi a3 (tfsi),16946.00,20/03/2024,2016,12344,hatchback,manual,petrol,navy audi a3. 1.4 tfsi cod s line hatchback 3dr petrol manual euro 6 (s/s) (150 ps). 1 previous owner,dublin
audi s5 (tfsi v6),30248.00,20/03/2024,2018,34336,hatchback,automatic,petrol,audi s5. 3.0 tfsi v6 sportback tiptronic quattro euro 6 (s/s) 5dr. 2 previous owners,meath
audi a1 (tfsi),9068.00,2024-03-21,2014,74169,hatchback,manual,petrol,black audi a1. 1.4 tfsi sport sportback 5dr petrol manual euro 5 (s/s) (122 ps),mayo
audi a5 (tfsi),30167,21/03/2024,2020,23824,hatchback,automatic,petrol,red audi a5. 2.0 tfsi 40 black edition sportback s tronic euro 6 (s/s) 5dr. 1 previous owner,limerick
audi a3 (edition 1),38007.00,2024-03-21,2022,6235,saloon,automatic,petrol,red audi a3. saloon edition 1 35 tfsi 150 ps s tronic 1.5 4dr. 1 previous owner,wicklow
audi rs4 avant (fsi v8),27266,2024-03-22,2014,63154,estate,automatic,petrol,red audi a4. 4.2 rs4 avant fsi quattro [pan] 5dr,roscommon
audi q2 (cod),23028.00,22/03/2024,2018,15052,suv,automatic,petrol,blue audi q2. 1.4 tfsi s line 5dr s tronic. 1 previous owner,kilkenny
audi a4 (tfsi),8716.00,2024-03-24,2012,62057,saloon,manual,petrol,navy audi a4. 1.8 tfsi se euro 5 (s/s) 4dr,dublin
audi tt (tdi),7253.00,26/03/2024,2009,77256,convertible,manual,diesel,silver audi tt. 2.0 tdi quattro 2d 170 bhp,cork
audi a1 (sport),8925.00,27/03/2024,2012,40247,hatchback,manual,diesel,red audi a1. 1.6 tdi sport sportback euro 5 (s/s) 5dr,donegal
audi a3 cabriolet (s line),9262.00,2024-03-29,2011,35087,convertible,manual,diesel,black audi a3 cabriolet. 1.6 tdi s line euro 5 (s/s) 2dr. 3 previous owners,wicklow
audi s3 (tfsi),17897.00,30/03/2024,2014,43175,hatchback,manual,petrol,audi s3. 2.0 tfsi sportback 5dr petrol quattro euro 6 (s/s) (300 ps),dublin
audi q7 (s line plus),21660.00,2024-03-31,2014,76131,suv,automatic,diesel,silver audi q7. 3.0 tdi v6 s line plus tiptronic quattro 5dr. 3 previous owners,cork
audi a5 (ultra),14105,01/04/2024,2017,114621,hatchback,manual,diesel,red audi a5. 2.0 sportback tdi ultra sport 5d 188 bhp +++finance available+++. 2 previous owners,carlow
audi a3 (s line),16666,02/04/2024,2017,38975,saloon,manual,petrol,audi a3. 1.5 tfsi s line 4dr,galway
audi a5 (se),4218.00,04/04/2024,2010,126673,hatchback,manual,diesel,blue audi a5. 2.0 tdi se sportback 5dr diesel manual euro 5 (s/s) (170 ps). 4 previous owners,kildare
audi a7 (black edition),41184.00,05/04/2024,2019,13146,hatchback,automatic,diesel,blue audi a7. 50 tdi quattro black edition 5dr tip auto 3.0,limerick
audi q3 (tfsi),24972.00,2024-04-06,2019,33393,suv,manual,petrol,grey audi q3. 1.5 tfsi sport 5d 148 bhp,laois
audi a3 (sport),6278.00,2024-04-08,2014,199119,saloon,manual,diesel,blue audi a3. 2.0 tdi sport 4d 148 bhp good history huge spec,clare
audi a3 cabriolet (tfsi),17815.00,2024-04-08,2015,29503,convertible,automatic,petrol,red audi a3 cabriolet. 1.8 tfsi s line s tronic 2dr. 3 previous owners,galway
audi q2 (s line),29483.00,10/04/2024,2021,14468,suv,automatic,diesel,grey audi q2. 30 tdi s line 5dr s tronic 2.0,louth
audi a5 (s line),14476.00,11/04/2024,2014,90483,hatchback,manual,petrol,red audi a5. 1.8 tfsi s line sportback 5dr petrol manual euro 6 (s/s) (170 ps). 2 previous owners,wicklow
audi a6 allroad (tdi v6),15994.00,11/04/2024,2016,127162,estate,automatic,diesel,grey audi a6. 3.0 allroad tdi quattro 5d 268 bhp,wexford
audi q3 (cod),29293.00,11/04/2024,2019,22404,suv,automatic,petrol,red audi q3. s line 35 tfsi 150 ps s tronic 1.5 5dr. 1 previous owner,cork
audi q5 (s line),22215,2024-04-13,2017,86425,suv,automatic,diesel,red audi q5. 2.0 tdi s line s tronic quattro euro 6 (s/s) 5dr. 1 previous owner,limerick
audi a5 (tdi),11292.00,13/04/2024,2014,95460,coupe,auto,diesel,audi a5. 2.0 tdi black edition s tronic quattro 2dr. 5 previous owners,galway
audi s5 (black edition),17694.00,2024-04-14,2015,53964,hatchback,automatic,petrol,navy audi s5. 3.0 tfsi v6 black edition sportback s tronic quattro 5dr. 3 previous owners,dublin
audi rs q3 (tfsi),58737.00,2024-04-15,2021,7318,suv,automatic,petrol,blue audi rs q3. 2.5 tfsi vorsprung s tronic quattro euro 6 (s/s) 5dr,dublin
audi a4 avant (black edition),26788.00,16/04/2024,2019,15240,estate,automatic,petrol,grey audi a4. 40 tfsi black edition 5dr s tronic 2.0,mayo
audi q3 (se),15258.00,16/04/2024,2015,45555,s.u.v.,manual,diesel,black audi q3. 2.0 tdi se quattro euro 6 (s/s) 5dr,dublin
audi q5 (sport),31355.00,2024-04-16,2019,15749,suv,automatic,petrol,audi q5. q5 sport 45 tfsi quattro 245 ps s tronic 2.0 5dr,wicklow
audi q5 (s line plus),20346.00,18/04/2024,2015,52488,suv,automatic,diesel,silver audi q5. 2.0 tdi s line plus s tronic quattro euro 6 (s/s) 5dr. 2 previous owners,cork
audi q3 (sport),27267.00,2024-04-18,2020,28026,suv,manual,petrol,audi q3. sport 35 tfsi 150 ps 6-speed 1.5 5dr. 1 previous owner,meath
audi a4 avant (tdi),29893.00,2024-04-19,2021,18994,estate,automatic,diesel,blue audi a4. avant s line 35 tdi 163 ps s tronic 2.0 5dr,cork
audi q4 e-tron (launch edition),57430.00,21/04/2024,2021,24064,suv,automatic,electric,"blue audi q4 e-tron. q4 launch edition 40 e-tron 150,00 kw 5dr. 1 previous owner",dublin
audi a4 (sport),17012.00,23/04/2024,2017,51314,saloon,automatic,petrol,black audi a4. 2.0 tfsi sport s tronic euro 6 (s/s) 4dr,meath
audi q5 (edition 1),50799.00,24/04/2024,2022,3951,suv,automatic,diesel,silver audi q5. 40 tdi quattro edition 1 5dr s tronic [c+s] 2.0. 1 previous owner,donegal
audi a1 (technik),19437.00,24/04/2024,2021,25718,hatchback,manual,petrol,audi a1. 25 tfsi technik 5dr 1.0,limerick
audi a3 (tfsi),8668.00,25/04/2024,2014,60022,hatchback,manual,petrol,red audi a3. 1.2 tfsi se sportback 5dr. 2 previous owners,dublin
audi a3 (tfsie),34452.00,2024-04-25,2020,12331,hatchback,automatic,petrol plug-in hybrid,blue audi a3. sportback s line 40 tfsi e 204 ps s tronic 1.4 5dr,kildare
audi q2 (technik),19590,25/04/2024,2020,11971,s.u.v.,manual,petrol,navy audi q2. 1l technik tfsi 5dr,donegal
audi a3 (cod),19267.00,26/04/2024,2019,45100,hatchback,automatic,petrol,audi a3. 1.5l s line cod tfsi 5dr,wexford
audi a5 (tfsi),14395.00,26/04/2024,2015,42428,coupe,manual,petrol,red audi a5. 1.8t fsi black edition plus 2dr,meath
audi tt (tdi),8154.00,2024-04-26,2011,73246,coupe,manual,diesel,red audi tt. 2.0 tdi black edition coupe 3dr diesel manual quattro euro 5 (170 ps). 1 previous owner,roscommon
audi a8 (tdi v6),29000.00,27/04/2024,2018,43791,saloon,automatic,diesel,red audi a8. 3.0 tdi quattro 4d 282 bhp. 1 previous owner,kildare
audi a3 (black edition),6961.00,27/04/2024,2009,88391,hatchback,manual,petrol,black audi a3. sportback tfsi s line special edition 1.8 5dr,kildare
audi a5 (tdi),7802.00,27/04/2024,2014,130245,hatchback,manual,diesel,audi a5. 2.0 sportback tdi 5d 177 bhp *upgraded alloys*. 2 previous owners,limerick
audi rs3 (tfsi),28455.00,30/04/2024,2015,62139,hatchback,automatic,petrol,red audi rs3. 2.5 tfsi sportback s tronic quattro euro 6 (s/s) 5dr,carlow
audi q2 (sport),15472.00,02/05/2024,2017,34861,suv,manual,petrol,silver audi q2. 1.0 tfsi sport euro 6 (s/s) 5dr. 2 previous owners,monaghan
audi q5 (tdi),31898.00,02/05/2024,2019,21396,suv,automatic,diesel,navy audi q5. 40 tdi quattro s line 5dr s tronic [tech pack] 2.0,cork
audi q7 (tdi v6),44085.00,04/05/2024,2019,16755,suv,automatic,diesel,silver audi q7. 50 tdi quattro s line 5dr tiptronic 3.0. 2 previous owners,wexford
audi a5 (tdi),34700.00,05/05/2024,2021,14999,hatchback,automatic,diesel,blue audi a5. sportback s line 35 tdi 163 ps s tronic 2.0 5dr. 1 previous owner,cavan
audi r8 (performance carbon black),127223.00,05/05/2024,2019,6955,coupe,automatic,petrol,black audi r8. fsi v10 quattro perform carbon bk 2dr s tronic 5.2,sligo
audi a4 avant (tfsi),26939.00,05/05/2024,2019,34043,estate,automatic,petrol,navy audi a4 avant. 40 tfsi black edition 5dr s tronic [tech pack] 2.0,dublin
audi a4 (black edition),20442.00,2024-05-07,2019,63215,saloon,automatic,petrol,blue audi a4. 2.0 tfsi black edition 4d 188 bhp. 1 previous owner,mayo
audi a6 allroad (tdi v6),28099.00,09/05/2024,2017,27680,estate,automatic,diesel,red audi a6 allroad. a6 allroad 3.0 tdi v6 sport allroad 5dr diesel s tronic quattro (s/s) (218 ps). 4 previous owners,dublin
audi a4 (black edition),23564.00,11/05/2024,2019,35185,saloon,automatic,diesel,grey audi a4. 2.0 tdi 40 black edition s tronic quattro euro 6 (s/s) 4dr. 2 previous owners,dublin
audi s4 avant (tfsi v6),13627.00,2024-05-13,2010,91457,estat,automatic,petrol,black audi s4. avant quattro 3.0 5dr,waterford
audi rs5 (fsi v8),25465.00,2024-05-13,2014,57925,coupe,automatic,petrol,red audi rs5. 4.2 fsi v8 s tronic quattro 2dr,donegal
audi a6 saloon (tdi),12782.00,14/05/2024,2015,124402,saloon,automatic,diesel,blue audi a6 saloon. 2.0 tdi ultra black edition s tronic euro 6 (s/s) 4dr. 2 previous owners,dublin
audi a1 (cod),10446.00,14/05/2024,2014,71572,hatchback,manual,petrol,blue audi a1. 1.4 tfsi cod black edition sportback euro 5 (s/s) 5dr. 2 previous owners,dublin
audi a5 (s line),24914.00,2024-05-15,2018,14809,hatchback,automatic,diesel,audi a5. 2.0 tdi ultra s line 5dr s tronic,dublin
audi a5 (tdi),15196.00,16/05/2024,2015,49618,coupe,manual,diesel,silver audi a5. 2.0 tdi 177 black edition 2dr. 3 previous owners,kildare
audi rs7 (carbon black),98123.00,2024-05-16,2021,2536,hatchback,automatic,petrol,black audi rs 7. carbon black 4.0 5dr,cork
audi a6 saloon (ultra),11119.00,18/05/2024,2014,64164,saloon,manual,diesel,red audi a6. 2.0 tdi ultra se 4d 188 bhp + service history+ sat nav dab+. 2 previous owners,roscommon
audi a3 cabriolet (cod),14539.00,18/05/2024,2016,74403,convertible,manual,petrol,red audi a3 cabriolet. 1.4 tfsi cod s line euro 6 (s/s) 2dr (nav),limerick
audi q3 (sport),29241.00,19/05/2024,2019,12160,suv,automatic,petrol,black audi q3. 35 tfsi sport 5dr s tronic 1.5. 1 previous owner,clare
audi a5 (black edition),15263.00,21/05/2024,2013,27036,coupe,manual,diesel,audi a5. 2.0 tdi black edition 2d 177 bhp. 2 previous owners,galway
audi a6 avant (tdi),10556.00,2024-05-22,2014,137255,estate,automatic,diesel,blue audi a6 avant. 2.0 tdi ultra s line s tronic euro 6 (s/s) 5dr. 2 previous owners,dublin
audi a5 (s line),21297.00,22/05/2024,2018,53316,coupe,automatic,diesel,audi a5. 2.0 tdi s line s tronic euro 6 (s/s) 2dr. 2 previous owners,waterford
audi q7 (tdi v6),30938.00,23/05/2024,2019,77412,suv,automatic,diesel,red audi q7. 3.0 tdi v6 s line suv 5dr diesel tiptronic quattro euro 6 (s/s) (218 ps). 1 previous owner,kildare
audi a1 (sport),5188.00,24/05/2024,2010,90731,hatchback,manual,diesel,blue audi a1. tdi sport hatchback 1.6 manual diesel 3dr. 5 previous owners,cork
audi a6 saloon (tdi),8353.00,24/05/2024,2011,94484,saloon,manual,diesel,black audi a6 saloon. 2.0 tdi s line euro 5 (s/s) 4dr,louth
audi a7 (bitdi v6),23103.00,26/05/2024,2015,68291,hatchback,automatic,diesel,audi a7. 3.0 bitdi v6 black edition sportback tiptronic quattro euro 6 (s/s) 5dr. 3 previous owners,meath
audi q2 (cod),18864.00,2024-05-26,2018,35666,suv,manual,petrol,blue audi q2. 1.4 tfsi s line 5dr. 1 previous owner,louth
audi q7 (tdi v8),8097.00,28/05/2024,2010,132012,suv,automatic,diesel,navy audi q7. 4.2 tdi v8 s line tiptronic quattro euro 5 5dr. 3 previous owners,dublin
audi tts (black edition),10037.00,2024-05-28,2012,103020,coupe,automatic,petrol,audi tts. 2.0 tfsi black edition s tronic quattro euro 5 3dr,dublin
audi s4 avant (tfsi v6),30332.00,29/05/2024,2017,52466,estate,automatic,petrol,blue audi s4 avant. 3.0 tfsi v6 tiptronic quattro euro 6 (s/s) 5dr. 2 previous owners,monaghan
audi s3 (tfsi),18737.00,31/05/2024,2015,49578,saloon,automatic,petrol,silver audi s3. 2.0 tfsi saloon 4dr petrol s tronic quattro euro 6 (s/s) (300 ps). 1 previous owner,kildare
audi a4 (ultra),17811.00,31/05/2024,2018,17883,saloon,manual,diesel,grey audi a4. 2.0 tdi ultra se 4dr,offaly
audi a6 saloon (tdi v6),12262.00,03/06/2024,2017,179088,saloon,automatic,diesel,red audi a6 saloon. 3.0 tdi v6 s line s tronic quattro euro 6 (s/s) 4dr. 2 previous owners,tipperary
audi tt (sport edition),35304.00,07/06/2024,2022,9048,coupe,auto,petrol,silver audi tt. coup- sport edition 45 tfsi 245 ps s tronic 2.0 3dr,wexford
audi a3 cabriolet (tfsi),23356.00,2024-06-09,2019,31375,convertible,automatic,petrol,black audi a3 cabriolet. 1.5 tfsi cod 35 s line convertible 2dr petrol s tronic euro 6 (s/s) (150 ps). 2 previous owners,dublin
audi q3 (tdi),31445.00,09/06/2024,2020,14256,suv,automatic,diesel,blue audi q3 avant. 35 tdi s line 5dr s tronic 2.0,dublin
audi a8 (executive se),10038.00,10/06/2024,2010,156239,saloon,automatic,diesel,blue audi a8. 3.0 tdi v6 executive se tiptronic quattro 4dr,meath
audi q2 (cod),29251.00,2024-06-10,2021,13130,suv,automatic,petrol,audi q2. s line 35 tfsi 150 ps s tronic 1.5 5dr,kilkenny
audi rs5 (limited edition),31640.00,11/06/2024,2015,47755,coupe,automatic,petrol,navy audi rs5. 4.2 fsi v8 limited edition s tronic quattro euro 5 2dr. 3 previous owners,dublin
audi q2 (tdi),19255.00,11/06/2024,2019,36848,suv,manual,diesel,grey audi q2. 30 tdi s line 5dr 1.6. 1 previous owner,kilkenny
audi a5 cabriolet (s line),7425.00,11/06/2024,2009,111283,convertible,automatic,petrol,silver audi a5 cabriolet. 2.0 tfsi s line multitronic euro 4 2dr. 7 previous owners,dublin
audi a4 (tfsi),33114.00,13/06/2024,2021,9733,saloon,automatic,petrol,silver audi a4. 40 tfsi 204 black edition 4dr s tronic 2.0. 1 previous owner,kildare
audi q5 (s line),42362.00,15/06/2024,2021,9061,suv,automatic,diesel,black audi q5. 2.0 tdi 40 s line s tronic quattro euro 6 (s/s) 5dr. 1 previous owner,mayo
audi a1 (tfsi),12885.00,16/06/2024,2015,33833,hatchback,manual,petrol,black audi a1. 1.4 tfsi s line sportback euro 6 (s/s) 5dr. 3 previous owners,meath
audi q2 (cod),28954.00,17/06/2024,2021,18056,suv,automatic,petrol,blue audi q2 estate. 35 tfsi s line 5dr s tronic 1.5. 1 previous owner,cork
audi q2 (tfsi),25377.00,18/06/2024,2021,8432,suv,manual,petrol,blue audi q2. sport 30 tfsi 110 ps 6-speed 1.0 5dr. 1 previous owner,mayo
audi a5 (tdi),21382.00,19/06/2024,2019,74145,hatchback,automatic,diesel,black audi a5. 35 tdi s line 5dr s tronic 2.0,waterford
audi q3 (tfsie),41738.00,2024-06-19,2022,10003,suv,automatic,petrol plug-in hybrid,silver audi q3. s line 45 tfsi e 245 ps s tronic 1.4 5dr,laois
audi q3 (tdi),37113.00,20/06/2024,2021,9875,suv,automatic,diesel,red audi q3. 2.0 tdi 35 s line sportback s tronic euro 6 (s/s) 5dr. 1 previous owner,dublin
audi tt (vorsprung),50347.00,24/06/2024,2022,3450,coupe,automatic,petrol,navy audi tt. 45 tfsi quaro vorsprung 2dr s tronic 2.0. 1 previous owner,cork
audi q7 (tdi v6),26069.00,25/06/2024,2016,115249,suv,automatic,diesel,navy audi q7. 3.0 tdi v6 s line tiptronic quattro euro 6 (s/s) 5dr. 3 previous owners,tipperary
audi a4 (ultra),9089.00,26/06/2024,2015,115304,saloon,manual,diesel,audi a4. 2.0 tdi ultra se euro 6 (s/s) 4dr. 2 previous owners,kildare
audi a5 (tdi),19442.00,26/06/2024,2016,36370,hatchback,automatic,diesel,silver audi a5. 2.0 tdi black edition plus sportback s tronic quattro euro 6 (s/s) 5dr,donegal
audi q3 (cod),34812.00,27/06/2024,2020,13432,suv,automatic,petrol,audi q3. 35 tfsi s line 5dr s tronic 1.5,kildare
audi a4 avant (s line),25719.00,01/07/2024,2019,16769,estate,automatic,diesel,red audi a4. avant s line 40 tdi 190 ps s tronic 2.0 5dr,dublin
audi q3 (tfsi),18437.00,02/07/2024,2015,55222,suv,automatic,petrol,audi q3. s line plus 2.0 tfsi quattro 180 ps s tronic 5dr. 3 previous owners,roscommon
audi a4 avant (s line),16815.00,02/07/2024,2016,92492,estate,automatic,diesel,red audi a4. 3.0 avant tdi quattro s line 5d auto 268 bhp cruise control & power tailgate. 2 previous owners,kerry
audi a6 saloon (s line),35959.00,02/07/2024,2018,15538,saloon,automatic,diesel,audi a6 saloon. 3.0 tdi v6 50 s line tiptronic quattro euro 6 (s/s) 4dr. 1 previous owner,dublin
audi a6 avant (se executive),15909.00,03/07/2024,2016,60596,estate,automatic,diesel,silver audi a6 avant. 2.0 tdi se executive avant s tronic quattro (s/s) 5dr. 1 previous owner,dublin
audi tt (tfsi),16932.00,04/07/2024,2016,54336,coupe,manual,petrol,silver audi tt. 2.0 tfsi s line coupe 3dr petrol euro 6 (s/s) (230 ps). 1 previous owner,cork
audi a4 avant (s line),28368.00,04/07/2024,2020,25291,estate,automatic,diesel,audi a4. 35 tdi s line 5dr s tronic 2.0,dublin
audi a5 cabriolet (tfsi),5929.00,04/07/2024,2009,95187,convertible,manual,petrol,grey audi a5 cabriolet. 2.0 tfsi s line cabriolet 2dr. 4 previous owners,kildare
audi a6 avant (tdi),19804.00,2024-07-05,2015,101936,estate,manual,diesel,navy audi a6 avant. 2.0 tdi ultra black edition euro 6 (s/s) 5dr. 3 previous owners,donegal
audi sq7 (tfsi v8),77353.00,06/07/2024,2021,12749,suv,automatic,petrol,black audi sq7. 4.0 tfsi v8 black edition suv 5dr petrol tiptronic quattro euro 6 (s/s) (507 ps),cavan
audi a3 (tfsi),17875.00,2024-07-08,2018,21912,hatchback,automatic,petrol,"audi a3. 1.5 tfsi sport 5dr s tronic [sat nav, xenon headlights, parking sensors, cruise control, dab radio, apple carplay]",dublin
audi q7 (tdi v6),43192.00,11/07/2024,2018,29961,suv,automatic,diesel,blue audi q7. 3.0 tdi v6 black edition tiptronic quattro euro 6 (s/s) 5dr. 2 previous owners,cork
audi a1 (tfsi),8065,13/07/2024,2011,74276,hatchback,manual,petrol,navy audi a1. 1.4 tfsi s line euro 5 (s/s) 3dr. 3 previous owners,kerry
audi q4 e-tron (s line),52870.00,13/07/2024,2021,5816,suv,automatic,electric,red audi q4. 125kw 35 55.52kwh s line 5dr auto. 1 previous owner,cork
audi a4 (tdi),12129.00,14/07/2024,2014,66435,saloon,manual,diesel,red audi a4. 2.0 tdi black edition euro 5 (s/s) 4dr,dublin
audi a4 (tfsi),16100.00,2024-07-15,2018,41152,saloon,manual,petrol,audi a4. 1.4l s line tfsi 4dr,tipperary
audi a3 (s line),15259.00,15/07/2024,2014,72443,saloon,automatic,petrol,black audi a3. 1.8 tfsi s line s tronic euro 6 (s/s) 4dr. 1 previous owner,dublin
audi a1 (sport),12062.00,2024-07-15,2016,36871,hatchback,manual,petrol,black audi a1. 1.0 tfsi sport sportback euro 6 (s/s) 5dr. 3 previous owners,dublin
audi a4 avant (executive s line),5442.00,2024-07-16,2010,130108,estate,automatic,diesel,red audi a4 avant. 2.0 tdi executive s line multitronic euro 4 5dr. 5 previous owners,cork
audi a6 avant (s line),9531.00,17/07/2024,2014,144565,estate,manual,diesel,blue audi a6 avant. 2.0 tdi ultra s line euro 6 (s/s) 5dr. 5 previous owners,dublin
audi q2 (s line),22161,17/07/2024,2019,27985,suv,automatic,petrol,black audi q2. 1.5 tfsi cod 35 s line suv 5dr petrol s tronic (s/s) (150 ps). 2 previous owners,dublin
audi s3 (tfsi),24929.00,18/07/2024,2017,62933,saloon,automatic,petrol,red audi s3. 2.0 tfsi saloon 4dr petrol s tronic quattro euro 6 (s/s) (310 ps). 1 previous owner,cork
audi a1 (sport),5959.00,2024-07-18,2013,71268,hatchback,manual,petrol,grey audi a1. 1.2 tfsi sport euro 5 (s/s) 3dr. 4 previous owners,cork
audi q3 (cod),22155.00,2024-07-20,2018,45258,suv,automatic,petrol,grey audi q3. audi q3 1.4t fsi black edition 5dr s tronic. 1 previous owner,kerry
audi tts (tfsi),12395.00,2024-07-23,2012,85229,coupe,manual,petrol,silver audi tts. 2.0 tfsi quattro 2dr. 2 previous owners,dublin
audi a5 cabriolet (s line),31896.00,24/07/2024,2020,25828,convertible,automatic,petrol,silver audi a5. 40 tfsi s line 2dr s tronic 2.0. 1 previous owner,kilkenny
audi a5 (se),4353.00,24/07/2024,2010,113763,coupe,manual,petrol,audi a5. 2.0 tfsi se euro 5 (s/s) 2dr. 3 previous owners,cork
audi a6 saloon (tdi),7917.00,25/07/2024,2011,86134,saloon,manual,diesel,silver audi a6 saloon. 2.0 tdi se euro 5 (s/s) 4dr. 3 previous owners,monaghan
audi tt (tfsi),20113,25/07/2024,2017,31186,coupe,automatic,petrol,red audi tt. 2.0t fsi sport 2dr s tronic bluetooth,dublin
audi a4 avant (tdi),28159.00,2024-07-25,2019,9925,estate,automatic,diesel,black audi a4. 35 tdi s line 5dr s tronic [tech pack] 2.0,dublin
audi tt (tfsi),14076.00,25/07/2024,2012,39054,coupe,automatic,petrol,silver audi tt. 2.0 tfsi black edition s tronic quattro 3dr,dublin
audi a6 saloon (sport),24937.00,26/07/2024,2019,45058,saloon,automatic,diesel,blue audi a6. 40 tdi sport 4dr s tronic 2.0,donegal
audi q2 (cod),17127.00,2024-07-26,2018,50068,s.u.v.,manual,petrol,red audi q2. 1.4 tfsi cod sport euro 6 (s/s) 5dr. 1 previous owner,kildare
audi sq7 (tdi v8),77381.00,28/07/2024,2020,20867,suv,automatic,diesel,black audi sq7. 4.0 tdi v8 vorsprung tiptronic quattro 5dr,cork
audi a4 (black edition),14412.00,2024-07-29,2015,62847,saloon,manual,diesel,audi a4. 2.0 tdi black edition euro 6 (s/s) 4dr (nav),kildare
audi q3 (cod),15998.00,01/08/2024,2015,69274,suv,automatic,petrol,black audi q3. 1.4 tfsi cod s line s tronic euro 6 (s/s) 5dr. 2 previous owners,dublin
audi q7 (s line),16718.00,01/08/2024,2011,90303,suv,automatic,diesel,audi q7. 4.2 tdi v8 s line suv 5dr diesel tiptronic quattro euro 5 (340 ps). 3 previous owners,meath
audi a3 (s line),11325.00,02/08/2024,2016,82602,hatchback,manual,diesel,silver audi a3. 2.0 tdi s line euro 6 (s/s) 3dr (nav). 2 previous owners,roscommon
audi a5 (black edition plus),13768.00,2024-08-03,2015,33190,coupe,manual,petrol,red audi a5. 1.8 tfsi black edition plus euro 6 (s/s) 2dr. 2 previous owners,limerick
audi a1 (black edition),13408.00,2024-08-03,2016,40377,hatchback,manual,petrol,black audi a1. 1.4 tfsi black edition 3d 148 bhp full audi service history. 2 previous owners,meath
audi a8 (tdi v6),34332.00,04/08/2024,2019,48326,saloon,automatic,diesel,silver audi a8. 50 tdi quattro s line 4dr tiptronic 3.0,dublin
audi q2 (tdi),21806.00,05/08/2024,2017,48065,suv,automatic,diesel,navy audi q2. 2.0 tdi edition 1 s tronic quattro (s/s) 5dr. 1 previous owner,louth
audi a5 (tdi),15629,07/08/2024,2016,63753,coupe,manual,diesel,grey audi a5. 2.0 tdi black edition plus euro 6 (s/s) 2dr,dublin
audi a5 (tdi),15490,07/08/2024,2016,67349,coupe,manual,diesel,blue audi a5. 2.0 tdi black edition plus coupe 2dr diesel manual quattro euro 6 (s/s) (190 ps),tipperary
audi a6 avant (tdi),46865.00,2024-08-09,2022,4460,estate,automatic,diesel,blue audi a6. 40 tdi quattro s line 5dr s tronic 2.0,meath
audi a3 (tfsi),16111.00,09/08/2024,2018,23644,hatchback,manual,petrol,"red audi a3. 1.5 tfsi sport 5d 148 bhp 7in satellite navigation display, apple carplay / android auto, rear parking sensors, dab / bluetooth / usb, dual-zone clima",laois
audi q2 (s line),24666.00,10/08/2024,2019,12288,suv,automatic,petrol,silver audi q2. 1.5 tfsi cod 35 s line s tronic euro 6 (s/s) 5dr. 1 previous owner,meath
audi a3 (sport),23802.00,10/08/2024,2020,18578,saloon,automatic,diesel,blue audi a3. saloon sport 35 tdi 150 ps s tronic 2.0 4dr. 1 previous owner,dublin
audi q2 (tfsi),20198,10/08/2024,2019,14363,suv,manual,petrol,blue audi q2. 1.0 tfsi sport 5dr,dublin
audi a3 (tdi),9241.00,2024-08-11,2014,78161,hatchback,manual,diesel,blue audi a3. 2.0 tdi sport sportback euro 5 (s/s) 5dr,louth
audi a5 (tfsi),33351.00,11/08/2024,2020,21535,coupe,automatic,petrol,red audi a5 coupe special editions. 40 tfsi edition 1 2dr s tronic 2.0. 1 previous owner,dublin
audi a5 cabriolet (s line),6916.00,13/08/2024,2009,85760,convertible,automatic,diesel,red audi a5 cabriolet. 3.0 tdi v6 s line convertible 2dr diesel s tronic quattro euro 4 (240 ps). 6 previous owners,wicklow
audi a4 (black edition),7750.00,14/08/2024,2012,118903,saloon,manual,diesel,red audi a4. 2.0 tdi black edition quattro euro 5 (s/s) 4dr. 2 previous owners,dublin
audi a4 (black edition),33744.00,15/08/2024,2021,10146,saloon,automatic,petrol,blue audi a4. black edition 40 tfsi 204 ps s tronic 2.0 4dr,dublin
audi q3 (sport),19365.00,16/08/2024,2018,28722,suv,manual,petrol,red audi q3. 1.4t fsi sport 5dr,dublin
audi a5 (s line),21869.00,16/08/2024,2017,45215,hatchback,automatic,diesel,red audi a5. tdi 150 s line 5dr s tronic 2.0,dublin
audi a3 (e-tron),17457.00,18/08/2024,2016,63700,hatchback,automatic,petrol plug-in hybrid,black audi a3. 1.4 tfsi e-tron sportback s tronic 5dr. 3 previous owners,carlow
audi a4 (tfsi),13427.00,19/08/2024,2016,65998,saloon,manual,petrol,audi a4. 1.4t fsi sport 4dr,dublin
audi a1 (sport),9402,20/08/2024,2014,39870,hatchback,manual,petrol,blue audi a1. tfsi sport petrol manual..full audi service history...air con...bluetooth.. 1.4 3dr. 2 previous owners,kilkenny
audi a3 (cod),14482,21/08/2024,2016,54075,hatchback,manual,petrol,blue audi a3. 1.4 tfsi cod s line sportback euro 6 (s/s) 5dr. 3 previous owners,cavan
audi a3 (black edition),20171,2024-08-23,2018,57497,hatchback,automatic,petrol,red audi a3. 2.0 tfsi quattro black edition 5dr s tronic. 2 previous owners,cork
audi q3 (s line edition),19973.00,24/08/2024,2017,15097,suv,manual,diesel,audi q3. 2.0 tdi quattro s line edition 5dr,tipperary
audi a5 (tfsi),23033.00,25/08/2024,2018,22577,hatchback,automatic,petrol,audi a5. 1.4 tfsi s line sportback s tronic euro 6 (s/s) 5dr. 1 previous owner,roscommon
audi a4 (sport),14346.00,2024-08-26,2017,42133,saloon,manual,petrol,audi a4. 1.4 tfsi sport euro 6 (s/s) 4dr. 2 previous owners,dublin
audi a3 (tdi),10022.00,26/08/2024,2017,96296,hatchback,manual,diesel,audi a3. 1.6 tdi sport sportback (s/s) 5dr. 1 previous owner,limerick
audi a4 avant (tdi),14208.00,26/08/2024,2016,61314,estate,manual,diesel,grey audi a4 avant. 2.0 tdi ultra se euro 6 (s/s) 5dr,kilkenny
audi a1 (technik),18015.00,27/08/2024,2020,21469,hatchback,manual,petrol,red audi a1. sportback technik 25 tfsi 95 ps 5-speed 1.0 5dr. 1 previous owner,roscommon
audi s3 (tfsi),26155.00,2024-08-27,2019,34967,hatchback,automatic,petrol,black audi s3. 2.0 tfsi sportback s tronic quattro euro 6 (s/s) 5dr. 1 previous owner,wexford
audi a3 (tfsi),14729.00,27/08/2024,2017,31513,hatchback,manual,petrol,blue audi a3. 1.0 sportback tfsi sport 5d 114 bhp air con alloys bluetooth. 2 previous owners,dublin
audi sq5 (bitdi v6),17922,2024-08-29,2014,85984,suv,automatic,diesel,blue audi sq5. 3.0 bitdi v6 tiptronic quattro euro 5 (s/s) 5dr,galway
audi tt (tfsi),17669.00,29/08/2024,2016,32143,coupe,manual,petrol,audi tt. 2.0 tfsi s line euro 6 (s/s) 3dr,dublin
audi q5 (s line),27659.00,30/08/2024,2018,57223,suv,automatic,diesel,navy audi q5. 2.0 tdi s line s tronic quattro euro 6 (s/s) 5dr. 1 previous owner,clare
audi r8 (fsi v10),56218.00,31/08/2024,2014,25162,coupe,automatic,petrol,red audi r8. 5.2 fsi v10 s tronic quattro 2dr. 5 previous owners,dublin
audi a3 (cod),13671.00,31/08/2024,2015,54031,hatchback,manual,petrol,red audi a3. 1.4 tfsi s line 5dr ** full audi service history **. 2 previous owners,dublin
audi tt (tdi),5937.00,01/09/2024,2009,114462,convertible,automatic,diesel,navy audi tt. 2.0 tdi s line roadster s tronic quattro euro 5 2dr,meath
audi a6 saloon (black edition),18205.00,2024-09-02,2016,33585,saloon,automatic,diesel,blue audi a6 saloon. 2.0 tdi ultra black edition s tronic (s/s) 4dr. 2 previous owners,laois
audi a4 (black edition),28493.00,03/09/2024,2020,21790,saloon,automatic,diesel,audi a4. 35 tdi black edition 4dr s tronic 2.0,dublin
audi q3 (tfsi),13274.00,2024-09-03,2014,68947,suv,manual,petrol,black audi q3. 1.4 tfsi s line euro 6 (s/s) 5dr,meath
audi q3 (black edition),22694.00,04/09/2024,2018,32238,suv,manual,diesel,black audi q3. 2.0 tdi quattro black edition 5 door **\xa3349 a month with \xa32295 deposit**. 2 previous owners,donegal
audi a4 (tdie),4949.00,05/09/2024,2013,136277,saloon,manual,diesel,blue audi a4. 2.0 tdie se technik euro 5 (s/s) 4dr. 3 previous owners,waterford
audi q3 (s line),29142.00,06/09/2024,2019,37389,s.u.v.,automatic,diesel,red audi q3. 40 tdi quattro s line 5dr s tronic 2.0. 3 previous owners,cork
audi a6 avant (tdi v6),20504.00,08/09/2024,2017,76654,estate,automatic,diesel,grey audi a6 avant. 3.0 tdi v6 s line s tronic quattro euro 6 (s/s) 5dr. 1 previous owner,dublin
audi a5 (s line),7908.00,09/09/2024,2012,89196,hatchback,automatic,diesel,red audi a5. 2.0 tdi s line sportback multitronic euro 5 (s/s) 5dr. 1 previous owner,limerick
audi a5 (tdi v6),10274.00,11/09/2024,2010,83097,hatchback,automatic,diesel,red audi a5. 3.0 tdi v6 s line sportback s tronic quattro euro 5 5dr,limerick
audi a5 (tdi),26753.00,12/09/2024,2019,25312,coupe,automatic,diesel,blue audi a5. 40 tdi black edition 2dr s tronic 2.0,dublin
audi a1 (sport),11195.00,12/09/2024,2017,65274,hatchback,manual,petrol,black audi a1. 1.4 tfsi sport 5dr,monaghan
audi a4 avant (s line),29919.00,12/09/2024,2021,17696,estate,automatic,diesel,black audi a4. 35 tdi s line 5dr s tronic 2.0. 1 previous owner,cork
audi a4 (tdi),3916.00,2024-09-12,2009,126392,saloon,manual,diesel,red audi a4. 2.0 tdi executive se saloon 4dr diesel manual euro 4 (143 ps). 3 previous owners,louth
audi a4 (se),15471.00,2024-09-13,2018,29053,saloon,manual,petrol,black audi a4. 1.4 tfsi se euro 6 (s/s) 4dr,kerry
audi a3 (cod),13336.00,13/09/2024,2018,80661,saloon,manual,petrol,black audi a3. 1.5 tfsi sport 4d 148 bhp. 1 previous owner,dublin
audi a3 (tdi),11174.00,13/09/2024,2016,77228,hatchback,manual,diesel,red audi a3. 2.0 tdi se technik sportback euro 6 (s/s) 5dr. 2 previous owners,kildare
audi a6 avant (black edition),21895.00,13/09/2024,2016,52893,estate,automatic,diesel,black audi a6 avant. 2.0 tdi ultra black edition estate 5dr diesel s tronic euro 6 (s/s) (190 ps). 3 previous owners,dublin
audi a6 avant (tdi v6),9774.00,14/09/2024,2010,97094,estate,automatic,diesel,blue audi a6 avant. 3.0 tdi v6 le mans tiptronic quattro euro 5 5dr. 3 previous owners,dublin
audi a7 (tdi),32812.00,14/09/2024,2019,22180,hatchback,automatic,diesel,red audi a7. 2.0 tdi 40 s line sportback 5dr diesel s tronic euro 6 (s/s) (204 ps). 3 previous owners,dublin
audi q7 (tdi v6),32285.00,2024-09-14,2017,42460,suv,automatic,diesel,red audi q7. 3.0 tdi v6 s line tiptronic quattro euro 6 (s/s) 5dr. 1 previous owner,kilkenny
audi s3 (tfsi),22672.00,17/09/2024,2016,48765,saloon,automatic,petrol,"navy audi s3. s3 quattro nav - triple black -comfort pk, heated seats -audi sound system 2.0 4dr",limerick
audi tt (s line),18015.00,17/09/2024,2015,50236,coupe,automatic,petrol,audi tt. 2.0 tfsi quattro s line 2d auto 227 bhp [virtual dash. part leather]. 2 previous owners,galway
audi tts (tfsi),24272.00,17/09/2024,2015,45489,coupe,automatic,petrol,red audi tts. 2.0 tfsi black edition s tronic quattro euro 6 (s/s) 3dr,monaghan
audi a3 (tfsi),17102,18/09/2024,2019,30917,saloon,manual,petrol,grey audi a3. 1l sport tfsi 4dr,dublin
audi rs4 avant (fsi v8),27703.00,2024-09-18,2014,67936,estate,automatic,petrol,blue audi rs4 avant. 4.2 fsi v8 s tronic quattro euro 5 5dr. 3 previous owners,dublin
audi q2 (tfsi),28206,19/09/2024,2021,10948,suv,automatic,petrol,black audi q2. sport 35 tfsi 150 ps s tronic 1.5 5dr. 1 previous owner,wicklow
audi s3 (tfsi),18352,19/09/2024,2015,71716,hatchback,automatic,petrol,navy audi s3. 2.0 tfsi sportback 5dr petrol s tronic quattro euro 6 (s/s) (300 ps). 2 previous owners,dublin
audi a5 (black edition),14371.00,2024-09-20,2013,39229,coupe,automatic,diesel,black audi a5. 2.0 tdi black edition multitronic euro 5 (s/s) 2dr,dublin
audi a1 (cod),13452.00,20/09/2024,2014,60277,hatchback,auto,petrol,silver audi a1. 1.4 sportback tfsi black edition 5d 138 bhp sensors + half leather + bluetooth,tipperary
audi q3 (s line),34744.00,22/09/2024,2020,12228,suv,automatic,petrol,silver audi q3. s line 40 tfsi quattro 190 ps s tronic 2.0 5dr. 1 previous owner,meath
audi q5 (tdi),22799.00,22/09/2024,2018,90102,suv,automatic,diesel,blue audi q5. 2.0 tdi sport s tronic quattro euro 6 (s/s) 5dr,dublin
audi a4 cabriolet (s line),4698.00,23/09/2024,2008,85286,convertible,automatic,petrol,black audi a4 cabriolet. 2.0 tfsi s line multitronic 2dr,kerry
audi q5 (edition 1),48700.00,23/09/2024,2022,1186,suv,automatic,petrol,silver audi q5 avant. 45 tfsi quattro edition 1 5dr s tronic 2.0,dublin
audi a6 saloon (tdi v6),30181.00,23/09/2024,2018,36814,saloon,automatic,diesel,black audi a6 diesel saloon. 50 tdi quattro s line 4dr tip auto 3.0,kildare
audi a4 avant (tfsi),23165.00,2024-09-23,2019,44601,estate,automatic,petrol,red audi a4. 35 tfsi sport 5dr s tronic 2.0,louth
audi q2 (black edition),21764.00,24/09/2024,2019,32261,suv,manual,petrol,navy audi q2. 1.5 tfsi cod 35 black edition suv 5dr petrol manual euro 6 (s/s) (150 ps). 2 previous owners,dublin
audi a5 cabriolet (tfsi),30108.00,24/09/2024,2019,7526,convertible,automatic,petrol,audi a5. 40 tfsi s line 2dr s tronic 2.0. 1 previous owner,cork
audi a6 saloon (ultra),12564.00,24/09/2024,2014,65180,saloon,manual,diesel,black audi a6 saloon. 2.0 tdi ultra black edition euro 6 (s/s) 4dr,dublin
audi a1 (s line),13753.00,25/09/2024,2017,26708,hatchback,manual,petrol,red audi a1. 1.4 tfsi cod s line euro 6 (s/s) 3dr. 2 previous owners,cork
audi a4 allroad (sport),16843.00,25/09/2024,2016,84536,estate,automatic,diesel,black audi a4 allroad. 2.0 allroad tdi quattro sport nav 5d 187 bhp tow bar! low finance! free warranty. 2 previous owners,cavan
audi a3 (cod),16902.00,29/09/2024,2018,36313,hatchback,manual,petrol,red audi a3. sportback sport 1.5 tfsi 150 ps 6-speed 5dr. 1 previous owner,galway
audi a3 (edition 1),34342.00,29/09/2024,2021,5989,saloon,automatic,diesel,blue audi a3. saloon edition 1 35 tdi 150 ps s tronic 2.0 4dr. 1 previous owner,dublin
audi q7 (black edition),30175.00,01/10/2024,2018,51382,suv,automatic,diesel,blue audi q7. 3.0 tdi v6 black edition tiptronic quattro euro 6 (s/s) 5dr. 5 previous owners,meath
audi q5 (s line),29422.00,02/10/2024,2017,33727,suv,automatic,petrol,audi q5. s line 2.0 tfsi quattro 252 ps s tronic 5dr,cork
audi a1 (s line),13753.00,02/10/2024,2018,58145,hatchback,manual,petrol,red audi a1. 1.4 tfsi s line nav 3d 123 bhp. 1 previous owner,clare
audi q3 (cod),17852.00,03/10/2024,2018,84616,suv,manual,petrol,black audi q3. 1.4t fsi black edition 5dr,cork
audi q3 (s line edition),15971.00,04/10/2024,2017,72574,suv,manual,diesel,grey audi q3. 2.0 tdi quattro s line edition 5dr,galway
audi a8 (tdi v6),36269.00,04/10/2024,2019,31491,saloon,automatic,diesel,audi a8. 3.0 tdi v6 50 s line tiptronic quattro euro 6 (s/s) 4dr. 1 previous owner,mayo
audi tt (s line),21002.00,05/10/2024,2015,23408,coupe,automatic,petrol,"black audi tt. 2.0 tfsi quattro s line 2d 227 bhp fdsh, satnav, bosesound, stunning. 2 previous owners",dublin
audi tt (tfsi),17162,2024-10-05,2014,34833,coupe,manual,petrol,navy audi tt. 2.0t fsi s line 2dr. 4 previous owners,tipperary
audi sq5 (tfsi v6),32673.00,06/10/2024,2017,68031,suv,automatic,petrol,black audi sq5. 3.0 tfsi v6 tiptronic quattro euro 6 (s/s) 5dr. 2 previous owners,monaghan
audi a6 saloon (tdi),11947.00,07/10/2024,2016,62816,saloon,manual,diesel,blue audi a6 saloon. 2.0 tdi ultra se executive euro 6 (s/s) 4dr. 3 previous owners,kildare
audi a1 (tfsi),11535.00,08/10/2024,2016,54725,hatchback,manual,petrol,blue audi a1. 1.4 tfsi sport 5dr,wicklow
audi a7 (s line),12900.00,2024-10-09,2011,77335,hatchback,automatic,diesel,grey audi a7. 3.0 tdi v6 s line sportback multitronic euro 5 (s/s) 5dr. 4 previous owners,tipperary
audi a4 (se),12977.00,12/10/2024,2017,84032,saloon,manual,diesel,audi a4. a4 2.0 tdi ultra se 4d 148 bhp,wexford
audi tt (ultra),13819.00,12/10/2024,2015,80626,coupe,manual,diesel,blue audi tt. 2.0 tdi ultra s line euro 6 (s/s) 3dr,donegal
audi a3 (tdi),6741.00,2024-10-13,2015,87698,hatchback,manual,diesel,grey audi a3. 2.0 tdi se technik sportback 5dr diesel manual euro 6 (s/s) (150 ps). 3 previous owners,dublin
audi q8 (tdi v6),42687,2024-10-13,2019,77126,suv,automatic,diesel,red audi q8. 3.0 tdi v6 50 s line suv 5dr diesel tiptronic quattro euro 6 (s/s) (286 ps). 1 previous owner,cork
audi tt (sport),15790.00,2024-10-14,2018,47273,coupe,automatic,petrol,navy audi tt. 1.8 tfsi sport s tronic euro 6 (s/s) 3dr,cork
audi a5 cabriolet (s line),5609.00,15/10/2024,2009,177142,convertible,manual,diesel,audi a5 cabriolet. 2.0 tdi s line euro 5 (s/s) 2dr. 5 previous owners,limerick
audi s4 (tfsi v6),21429.00,2024-10-16,2014,42200,saloon,automatic,petrol,grey audi s4. 3.0 tfsi v6 s tronic quattro euro 5 (s/s) 4dr,dublin
audi a4 avant (sport),12385.00,2024-10-16,2017,98456,estate,manual,diesel,navy audi a4 avant. 2.0 tdi ultra sport euro 6 (s/s) 5dr. 1 previous owner,dublin
audi a4 avant (executive se),2835.00,2024-10-17,2009,181663,estate,manual,diesel,black audi a4 avant. 2.0 tdi executive se euro 4 5dr,kildare
audi a3 (black edition),21821.00,2024-10-19,2019,21171,hatchback,manual,petrol,audi a3. 1.0 tfsi 30 black edition sportback euro 6 (s/s) 5dr. 1 previous owner,donegal
audi a4 avant (se),4741.00,19/10/2024,2009,90012,estate,automatic,diesel,navy audi a4 avant. 2.0 tdi se cvt 5dr,kilkenny
audi q3 (s line plus),16310.00,19/10/2024,2015,60291,suv,manual,diesel,silver audi q3. 2.0 tdi s line plus suv 5dr diesel quattro euro 6 (s/s) (150 ps). 2 previous owners,dublin
audi a5 (se technik),6924,2024-10-20,2014,147656,hatchback,manual,diesel,blue audi a5. 2.0 tdi se technik sportback euro 5 (s/s) 5dr. 2 previous owners,limerick
audi a3 cabriolet (tfsi),16743,20/10/2024,2016,53507,convertible,manual,petrol,blue audi a3. 1.4 tfsi s line 2dr,donegal
audi a1 (tfsi),12854.00,22/10/2024,2017,17633,hatchback,manual,petrol,grey audi a1. 1.4l sport tfsi 3dr,cork
audi s4 (tfsi v6),26233.00,2024-10-24,2017,22975,saloon,automatic,petrol,silver audi s4. 3l tfsi v6 4dr,louth
audi a4 (black edition),24025.00,26/10/2024,2019,39261,saloon,automatic,diesel,grey audi a4. 2.0 tdi 40 black edition s tronic (s/s) 4dr. 2 previous owners,kildare
audi rs6 avant (carbon black),100143.00,26/10/2024,2020,11268,estate,automatic,petrol,blue audi rs6 avant. 4.0 tfsi v8 carbon black estate 5dr petrol tiptronic quattro euro 6 (s/s) (600 ps). 2 previous owners,meath
audi a6 saloon (black edition),19277.00,2024-10-26,2017,57367,saloon,automatic,diesel,audi a6 saloon. 2.0 tdi ultra black edition s tronic euro 6 (s/s) 4dr. 2 previous owners,dublin
audi rs q3 (audi sport edition),66433.00,27/10/2024,2022,515,suv,automatic,petrol,red audi rs q3 avant. tfsi quattro audi sport ed 5dr s tronic[c+s] 2.5,dublin
audi a6 avant (s line),37183.00,28/10/2024,2019,23444,estate,automatic,petrol,black audi a6 avant. 2.0 tfsi 45 s line s tronic quattro euro 6 (s/s) 5dr. 1 previous owner,dublin
audi q5 (tdi),12726.00,29/10/2024,2011,73472,suv,automatic,diesel,audi q5. 2.0 tdi s line s tronic quattro euro 5 5dr. 2 previous owners,galway
audi r8 (fsi v10),89143.00,30/10/2024,2017,32060,coupe,automatic,petrol,navy audi r8. 5.2 fsi v10 plus s tronic quattro (s/s) 2dr,dublin
audi q7 (tdi v6),27856.00,01/11/2024,2015,71791,suv,automatic,diesel,blue audi q7. 3.0 tdi quattro s line 5dr tip auto,offaly
audi s8 (tfsi v8),24491.00,02/11/2024,2014,97240,saloon,automatic,petrol,blue audi s8. 4.0 tfsi v8 tiptronic quattro 4dr. 5 previous owners,cork
audi a6 allroad (sport),19365.00,2024-11-03,2016,81920,estate,automatic,diesel,black audi a6. 3.0 allroad tdi quattro sport 5d 215 bhp. 2 previous owners,dublin
audi q4 e-tron (edition 1),53800.00,05/11/2024,2021,9591,suv,automatic,electric,"red audi q4 e-tron. q4 edition 1 35 e-tron 125,00 kw 5dr. 1 previous owner",dublin
audi a5 (tfsi),26190.00,05/11/2024,2019,26046,hatchback,automatic,petrol,navy audi a5. 35 tfsi s line 5dr s tronic 2.0,dublin
audi a6 saloon (black edition),37196,07/11/2024,2021,13041,saloon,automatic,diesel,black audi a6 saloon. 2.0 tdi 40 black edition s tronic quattro euro 6 (s/s) 4dr. 2 previous owners,carlow
audi a1 (sport),7019.00,07/11/2024,2013,83181,hatchback,manual,petrol,"red audi a1. 1.4 tfsi sport 3d 122 bhp + service history, + 3 mth warranty. 2 previous owners",dublin
audi a4 allroad (tdi),9220.00,2024-11-08,2013,114858,estate,manual,diesel,black audi a4 allroad. 2.0 tdi quattro euro 5 (s/s) 5dr. 2 previous owners,kerry
audi q7 (tfsi v6),68278.00,2024-11-09,2022,5367,suv,automatic,petrol,silver audi q7. 55 tfsi quattro black edition 5dr tiptronic 3.0. 1 previous owner,dublin
audi rs3 (tfsi),65802.00,09/11/2024,2022,1476,saloon,automatic,petrol,silver audi rs3. rs 3 tfsi quattro carbon black 4dr s tronic 2.5,carlow
audi a4 (tdi),27310.00,10/11/2024,2019,29457,saloon,automatic,diesel,black audi a4. black edition 40 tdi 190 ps s tronic 2.0 4dr,waterford
audi a3 (tdi),4179.00,10/11/2024,2009,110125,hatchback,manual,diesel,blue audi a3. 2.0 tdi s line euro 4 3dr,tipperary
audi q4 e-tron (launch edition),60384.00,2024-11-10,2022,14553,suv,automatic,electric,red audi q4 e-tron. 40 launch edition sportback auto 5dr 82kwh,roscommon
audi s1 (tfsi),17774.00,10/11/2024,2015,52619,hatchback,manual,petrol,audi s1. 2.0 tfsi sportback quattro euro 6 (s/s) 5dr. 3 previous owners,dublin
audi q7 (vorsprung),55362.00,11/11/2024,2019,20088,suv,automatic,diesel,black audi q7. 3.0 tdi v6 50 vorsprung tiptronic quattro euro 6 (s/s) 5dr. 1 previous owner,cork
audi a1 (sport),5983.00,2024-11-11,2011,100068,hatchback,manual,petrol,silver audi a1. 1.4 tfsi sport euro 5 (s/s) 3dr. 4 previous owners,dublin
audi q5 (sport),30916,2024-11-11,2019,18516,suv,automatic,diesel,grey audi q5. sport 40 tdi quattro 190 ps s tronic 2.0 5dr,roscommon
audi r8 (fsi v10),126425.00,13/11/2024,2020,11761,coupe,automatic,petrol,audi r8. 5.2 fsi v10 performance carbon black s tronic quattro (s/s) 2dr,galway
audi a4 (black edition),32328.00,2024-11-14,2021,7552,saloon,automatic,diesel,audi a4. black edition 35 tdi 163 ps s tronic 2.0 4dr,dublin
audi a6 avant (tdi),7773.00,15/11/2024,2012,140143,estate,manual,diesel,black audi a6 avant. 2.0 tdi se 5dr. 3 previous owners,galway
audi q7 (tdi v6),57335.00,15/11/2024,2021,14923,suv,automatic,diesel,blue audi q7. 3.0 tdi v6 45 black edition tiptronic quattro euro 6 (s/s) 5dr. 1 previous owner,dublin
audi s4 avant (tfsi v6),26769.00,15/11/2024,2017,70189,estate,automatic,petrol,audi a4. s4 quattro tip tronic [light & vision pack] 3.0 5dr,wexford
audi q5 (s line),29612,15/11/2024,2019,46642,suv,automatic,diesel,navy audi q5. 40 tdi quattro s line 5dr s tronic [tech pack] 2.0. 1 previous owner,kerry
audi a6 saloon (ultra),15447.00,16/11/2024,2015,60068,saloon,automatic,diesel,navy audi a6 saloon. 2.0 tdi ultra s line s tronic euro 6 (s/s) 4dr. 3 previous owners,mayo
audi a5 (se technik),10326,18/11/2024,2013,71023,hatchback,automatic,diesel,red audi a5. 2.0 tdi se technik sportback multitronic euro 5 (s/s) 5dr. 3 previous owners,wexford
audi s3 (tfsi),27940.00,2024-11-19,2018,25584,hatchback,automatic,petrol,black audi a3. s3 tfsi quattro black edition 5dr s tronic 2.0. 3 previous owners,dublin
audi q2 (cod),19252.00,20/11/2024,2017,35342,suv,automatic,petrol,audi q2. 1.4l sport cod tfsi 5dr,dublin
audi a8 (sport),58152.00,20/11/2024,2021,3883,saloon,automatic,petrol plug-in hybrid,red audi a8. 60 tfsi e quattro sport 4dr tiptronic 3.0. 1 previous owner,laois
audi a4 (ultra),14346.00,2024-11-20,2016,55122,saloon,manual,diesel,red audi a4. 2.0 tdi ultra se 4d 148 bhp ****uk delivery available****. 2 previous owners,dublin
audi a5 (tdi),17818.00,21/11/2024,2017,80413,hatchback,automatic,diesel,silver audi a5. 2.0 tdi s line sportback s tronic quattro euro 6 (s/s) 5dr,westmeath
audi a6 saloon (se),2878,21/11/2024,2009,103339,saloon,automatic,diesel,audi a6 saloon. 2.0 tdi se multitronic euro 5 4dr,dublin
audi a1 (sport),11216.00,21/11/2024,2017,48364,hatchback,manual,petrol,grey audi a1. 1.0 tfsi sport 3dr,waterford
audi a4 (tfsi),29298.00,22/11/2024,2019,10463,saloon,automatic,petrol,black audi a4. 40 tfsi black edition 4dr s tronic 2.0,limerick
audi a5 (s line),39409.00,22/11/2024,2021,7303,hatchback,automatic,petrol,blue audi a5. 40 tfsi 204 s line 5dr s tronic 2.0,dublin
audi a5 (tfsi),22294,24/11/2024,2019,13429,coupe,manual,petrol,silver audi a5. tfsi sport 2.0 2dr. 1 previous owner,wexford
audi a4 avant (s line),31789.00,25/11/2024,2021,12646,estate,automatic,diesel,grey audi a4. avant s line 35 tdi 163 ps s tronic 2.0 5dr,dublin
audi q7 (tdi v6),30111.00,26/11/2024,2017,81213,suv,auto,diesel,audi q7. 3.0 tdi 218 quattro s line 5dr tip auto. 2 previous owners,kilkenny
audi a4 (s line),24309.00,26/11/2024,2019,29833,saloon,automatic,diesel,navy audi a4. 2.0 tdi 40 s line s tronic quattro euro 6 (s/s) 4dr. 2 previous owners,mayo
audi sq8 (tdi v8),75505.00,27/11/2024,2020,37165,suv,automatic,diesel,red audi q8. sq8 tdi quattro vorsprung 5dr tiptronic 4.0. 1 previous owner,galway
audi tt (tdi),11980.00,28/11/2024,2013,95397,coupe,manual,diesel,audi tt. 2.0 tdi quattro black edition 2d 168 bhp. 1 previous owner,cork
audi rs5 (tfsi v6),51292.00,01/12/2024,2019,19766,coupe,automatic,petrol,red audi rs5. rs 5 coup- sport edition 450 ps tiptronic 2.9 2dr,dublin
audi a4 avant (black edition),30001.00,02/12/2024,2020,16867,estate,automatic,petrol,blue audi a4. avant black edition 35 tfsi 150 ps s tronic 2.0 5dr. 1 previous owner,dublin
audi e-tron (sport),51749.00,2024-12-02,2021,9237,suv,automatic,electric,audi e-tron. 230kw 50 quattro 71kwh sport 5dr auto. 2 previous owners,cork
audi sq5 (bitdi v6),22772.00,02/12/2024,2014,55445,suv,automatic,diesel,red audi sq5. 3.0 bitdi v6 tiptronic quattro euro 5 (s/s) 5dr,dublin
audi q5 (tdi),15403,03/12/2024,2013,72786,suv,automatic,diesel,"red audi q5. 2.0 tdi quattro s line plus 5d 175 bhp 12 months mot, 3 months warranty",dublin
audi a3 (sport),5058.00,04/12/2024,2009,66142,hatchback,manual,diesel,blue audi a3. 2.0 tdi sport sportback euro 4 5dr,leitrim
audi a1 (s line),16624.00,06/12/2024,2018,39208,hatchback,automatic,diesel,red audi a1. tdi s line nav 5dr s tronic 1.6,meath
audi q3 (black edition),34239.00,10/12/2024,2021,10458,suv,manual,petrol,"black audi q3. 35 tfsi black edition 5dr [audi virtual cockpit - 10.25"" display,rear parking sensors ,camera based traffic sign recognition,dab digital radio,black s",dublin
audi a4 avant (s line),13794.00,2024-12-10,2013,39301,estate,automatic,diesel,blue audi a4 avant. 2.0 tdi s line multitronic euro 5 (s/s) 5dr. 3 previous owners,limerick
audi q5 (tfsie),53773.00,11/12/2024,2021,9225,suv,automatic,petrol plug-in hybrid,red audi q5. edition 1 50 tfsi e quattro 299 ps s tronic 2.0 5dr,leitrim
audi q3 (tfsi),33759.00,14/12/2024,2020,29076,suv,automatic,petrol,red audi q3 avant. 40 tfsi quattro s line 5dr s tronic 2.0,kerry
audi q3 (tfsi),26912.00,15/12/2024,2019,40692,suv,automatic,petrol,red audi q3. 1.5 tfsi cod 35 s line s tronic euro 6 (s/s) 5dr. 1 previous owner,tipperary
audi a6 saloon (ultra),16837.00,15/12/2024,2015,52364,saloon,automatic,diesel,blue audi a6 saloon. 2.0 tdi ultra black edition saloon 4dr diesel s tronic euro 6 (s/s) (190 ps). 1 previous owner,dublin
audi q2 (s line),18968,16/12/2024,2019,56351,suv,automatic,diesel,red audi q2. 1.6 tdi s line 5d 114 bhp auto + bluetooth + parking sensors,cork
audi a5 (s line),20445.00,16/12/2024,2018,45796,hatchback,automatic,petrol,blue audi a5. 2.0 tfsi s line sportback s tronic euro 6 (s/s) 5dr. 2 previous owners,kerry
audi q3 (tfsi),29473,19/12/2024,2019,30700,suv,automatic,petrol,black audi q3. s line 35 tfsi 150 ps s tronic 1.5 5dr,galway
audi a3 (tfsi),8070.00,22/12/2024,2016,137270,hatchback,manual,petrol,black audi a3. 1.4 tfsi sport nav 5d 148 bhp cruise control * door mirrors. 2 previous owners,galway
audi q5 (s line plus),20327.00,22/12/2024,2017,44225,suv,manual,diesel,black audi q5. 2.0 tdi [190] quattro s line plus 5dr. 2 previous owners,cork
audi a1 (black edition),11311.00,22/12/2024,2016,84958,hatchback,manual,petrol,black audi a1. 1.4 tfsi black edition 3d 148 bhp. 2 previous owners,donegal
audi s3 (black edition),29479.00,22/12/2024,2017,20307,hatchback,automatic,petrol,audi s3. 2.0 tfsi black edition sportback s tronic quattro euro 6 (s/s) 5dr,limerick
