Name,SalePrice,DateOfSale,Year,Mileage,Classification,Transmission,FuelType,Description,SaleLocation
bmw 1 series (116d),9445.00,2024-01-02,2017,41159,hatchback,automatic,diesel,red bmw 1 series. 1.5 116d se auto euro 6 (s/s) 5dr. 3 previous owners,kerry
bmw 3 series (se business edition),6495.00,02/01/2024,2010,103469,estate,automatic,diesel,grey bmw 3 series. 2.0 320d se business edition touring 5dr. 2 previous owners,galway
bmw x1 (se),15429.00,03/01/2024,2017,43571,suv,manual,diesel,bmw x1. xdrive 18d se 5dr diesel estate 2.0,donegal
bmw 8 series (840d),58023.00,05/01/2024,2020,10505,convertible,automatic,diesel,black bmw 8 series. 840d xdrive convertible 3.0 2dr. 2 previous owners,dublin
bmw 4 series gran coupe (420i),20962.00,2024-01-07,2018,33570,hatchback,automatic,petrol,black bmw 4 series gran coupe. 420i m sport gran coupe 2.0 5dr. 1 previous owner,dublin
bmw m5 (v8),25443,2024-01-07,2014,66377,saloon,automatic,petrol,blue bmw m5. 4.4 v8 dct euro 5 (s/s) 4dr. 6 previous owners,cork
bmw x3 (20d),3733.00,07/01/2024,2009,157218,suv,manual,diesel,red bmw x3. 2.0 20d se edition premium suv 5dr diesel manual xdrive euro 5 (177 ps). 3 previous owners,wicklow
bmw 1 series (performance edition),4559.00,08/01/2024,2011,107233,hatchback,manual,petrol,bmw 1 series. 2.0 116i performance edition 5dr,kilkenny
bmw m4 (competition),43461.00,2024-01-09,2020,21969,coupe,automatic,petrol,silver bmw m4. 3.0 biturbo competition dct euro 6 (s/s) 2dr,limerick
bmw x1 (se),10164.00,10/01/2024,2014,56850,suv,manual,diesel,bmw x1. 2.0 20d se xdrive euro 5 (s/s) 5dr. 3 previous owners,cavan
bmw 3 series (se),7237.00,10/01/2024,2010,43280,saloon,automatic,petrol,navy bmw 3 series saloon. 2.0 318i se saloon 4dr petrol steptronic euro 5 143 ps saloon 4dr petrol au,mayo
bmw 2 series (m sport),15898.00,12/01/2024,2015,33180,convertible,automatic,diesel,red bmw 2 series. 2.0 220d m sport auto (s/s) 2dr*,dublin
bmw 1 series (116d),20240.00,13/01/2024,2019,18085,hatchback,manual,diesel,grey bmw 1 series. 1.5 116d m sport shadow edition 5d 114 bhp + low rate finance available +. 2 previous owners,offaly
bmw 7 series (exclusive),26317.00,13/01/2024,2017,100192,saloon,automatic,petrol,blue bmw 7 series. 3.0 740li exclusive 4dr,mayo
bmw 1 series (114i),6465.00,13/01/2024,2013,112118,hatchback,manual,petrol,black bmw 1 series. 1.6 114i sport euro 6 (s/s) 5dr. 3 previous owners,leitrim
bmw x5 (30d),29682.00,14/01/2024,2016,45500,suv,auto,diesel,blue bmw x5. 3.0 30d m sport auto xdrive euro 6 (s/s) 5dr. 2 previous owners,kildare
bmw 1 series (m135i),37617.00,15/01/2024,2021,8613,hatchback,automatic,petrol,bmw 1 series. m135i xdrive 2.0 5dr. 1 previous owner,cavan
bmw 4 series (m sport),13450.00,16/01/2024,2015,51368,convertible,automatic,diesel,red bmw 4 series. 2.0 420d m sport auto euro 6 (s/s) 2dr. 2 previous owners,wicklow
bmw 1 series (125d),16892.00,18/01/2024,2017,61598,hatchback,automatic,diesel,blue bmw 1 series. 2.0 125d m sport auto euro 6 (s/s) 5dr. 2 previous owners,galway
bmw 4 series (m sport),14095.00,19/01/2024,2015,49017,coupe,manual,diesel,black bmw 4 series. 2.0 420d m sport euro 6 (s/s) 2dr. 4 previous owners,limerick
bmw 5 series (se),19225.00,20/01/2024,2017,65089,saloon,automatic,diesel,bmw 5 series. 2.0 520d se auto xdrive euro 6 (s/s) 4dr,waterford
bmw 1 series (sport),11986.00,20/01/2024,2016,60076,hatchback,manual,diesel,blue bmw 1 series. 2.0 118d sport euro 6 (s/s) 5dr. 3 previous owners,laois
bmw 1 series (sport),4138.00,2024-01-22,2009,96359,hatchback,manual,diesel,blue bmw 1 series. 2.0 118d sport hatchback 5dr diesel manual euro 5 (143 ps). 3 previous owners,laois
bmw 5 series (530d),7071.00,23/01/2024,2008,120443,saloon,automatic,diesel,bmw 5 series. 3.0 530d m sport steptronic euro 4 4dr. 4 previous owners,limerick
bmw x3 (m sport),16483.00,2024-01-24,2014,72281,suv,automatic,diesel,bmw x3. 3.0 30d m sport auto xdrive euro 5 (s/s) 5dr,meath
bmw 1 series (120i),6283.00,25/01/2024,2008,95222,convertible,manual,petrol,blue bmw 1 series. 2.0 120i se 2d 168 bhp 3 month warranty ulez low miles 120,sligo
bmw 1 series (118i),16210.00,2024-01-26,2019,30389,hatchback,manual,petrol,navy bmw 1 series. 118i sport 1.5 5dr. 3 previous owners,dublin
bmw x6 (40d),17357.00,28/01/2024,2014,84480,suv,automatic,diesel,silver bmw x6. 3.0 40d auto xdrive euro 5 5dr. 5 previous owners,sligo
bmw 3 series (320d),4468.00,28/01/2024,2010,88663,saloon,manual,diesel,navy bmw 3 series. 2.0 320d m sport euro 5 4dr. 1 previous owner,mayo
bmw m4 (competition m),78327.00,29/01/2024,2022,6804,convertible,automatic,petrol,bmw m4 series. m4 competition m xdrive convertible 3.0 2dr. 1 previous owner,wexford
bmw x1 (20d),19298.00,31/01/2024,2017,43802,suv,automatic,diesel,silver bmw x1. 2.0 20d m sport suv 5dr diesel auto xdrive euro 6 (s/s) (190 ps). 2 previous owners,donegal
bmw 1 series (120d),17321.00,02/02/2024,2018,56526,hatchback,automatic,diesel,grey bmw 1 series. 120d m sport 5dr [nav/servotronic] step auto 2.0,galway
bmw 4 series (m440i),53045.00,02/02/2024,2021,6939,convertible,automatic,petrol hybrid,blue bmw 4 series. m440i xdrive convertible 3.0 2dr. 2 previous owners,laois
bmw 1 series (118d),17643.00,03/02/2024,2018,34193,hatchback,automatic,diesel,black bmw 1 series 5 door. 2.0 118d m sport hatchback 5dr diesel auto euro 6 s/s 150 ps hatchback 5dr,meath
bmw 5 series (m sport),16393.00,05/02/2024,2015,45692,saloon,automatic,diesel,black bmw 5 series saloon. 2.0 520d m sport saloon 4dr diesel auto euro 6 s/s 190 ps saloon 4dr diesel,dublin
bmw 1 series (116d),11872.00,05/02/2024,2013,58902,hatchback,automatic,diesel,blue bmw 1 series. 2.0 116d m sport 5d 114 bhp,cork
bmw 3 series (mht),34308.00,2024-02-06,2021,33989,estate,automatic,diesel hybrid,blue bmw 3 series. 320d se touring 2.0 5dr. 1 previous owner,dublin
bmw 3 series (m340d),42663.00,2024-02-07,2021,11442,saloon,automatic,diesel hybrid,blue bmw 3 series. 3.0 m340d mht auto xdrive euro 6 (s/s) 4dr. 2 previous owners,kildare
bmw 5 series (m sport),17406.00,09/02/2024,2018,119635,saloon,automatic,diesel,bmw 5 series. 2.0 520d m sport auto xdrive euro 6 (s/s) 4dr. 3 previous owners,cork
bmw 4 series gran coupe (418d),12463.00,09/02/2024,2014,89183,hatchback,automatic,diesel,blue bmw 4 series gran coupe. 2.0 418d sport auto euro 6 (s/s) 5dr. 2 previous owners,meath
bmw 1 series (m135i),17117.00,10/02/2024,2014,55166,hatchback,automatic,petrol,red bmw 1 series. 3.0 m135i auto euro 6 (s/s) 3dr,dublin
bmw 1 series (116d),4221.00,10/02/2024,2012,123762,hatchback,manual,diesel,navy bmw 1 series. 2.0 116d es 5dr. 3 previous owners,dublin
bmw 3 series gran turismo (m sport),13863.00,10/02/2024,2013,48476,hatchback,automatic,petrol,bmw 3 series gran turismo. 3.0 335i m sport gt auto (s/s) 5dr. 5 previous owners,dublin
bmw 3 series (m340i),38472.00,10/02/2024,2020,30276,saloon,automatic,petrol,black bmw 3 series. m340i xdrive 3.0 4dr. 1 previous owner,kildare
bmw m2 (cs),80349.00,10/02/2024,2020,8266,coupe,manual,petrol,bmw m2. 3.0 biturbo cs (s/s) 2dr,cork
bmw 1 series (m sport shadow edition),18883.00,12/02/2024,2017,30071,hatchback,automatic,diesel,"red bmw 1 series. 2.0 118d m sport shadow edition 5d 147 bhp fbmwsh, sat nav, harman/kardon. 2 previous owners",cork
bmw 3 series (320d),4673.00,15/02/2024,2010,142025,coupe,manual,diesel,bmw 3 series. 2.0 320d m sport 2dr. 5 previous owners,dublin
bmw 6 series gran coupe (640i),21281.00,15/02/2024,2016,47634,saloon,automatic,petrol,blue bmw 6 series gran coupe. 3.0 640i m sport auto euro 6 (s/s) 4dr,louth
bmw 1 series (116i),4049.00,2024-02-16,2010,80470,hatchback,manual,petrol,red bmw 1 series. 2.0 116i se 5dr,mayo
bmw 1 series (sport),8928,2024-02-21,2013,54304,hatchback,manual,petrol,black bmw 1 series. 114i sport 3dr ++ ulez / dab / bluetooth / diamond cut alloys ++ 1.6,galway
bmw 5 series (se),21437.00,22/02/2024,2018,49961,saloon,automatic,petrol plug-in hybrid,black bmw 5 series. 2.0 530e 9.2kwh se saloon 4dr petrol plug-in hybrid auto euro 6 (s/s) (252 ps). 1 previous owner,wicklow
bmw 7 series (730d),36186,23/02/2024,2018,22474,saloon,automatic,diesel,bmw 7 series. 3.0 730d m sport auto euro 6 (s/s) 4dr. 2 previous owners,cork
bmw x3 (se),9422.00,25/02/2024,2011,101386,s.u.v.,automatic,diesel,bmw x3 diesel estate. 2.0 xdrive20d se 5dr automatic. 1 previous owner,cork
bmw 3 series gran turismo (335d),15887.00,2024-02-26,2015,63240,hatchback,automatic,diesel,red bmw 3 series. 335d xdrive m sport gran turismo 3.0 5dr. 3 previous owners,donegal
bmw 1 series (120i),18952.00,2024-02-27,2018,44912,hatchback,auto,petrol,navy bmw 1 series. 120i sport 5-door 2.0 5dr. 1 previous owner,cork
bmw 3 series (330d),42328.00,28/02/2024,2021,7137,estate,automatic,diesel hybrid,black bmw 3 series. 330d m sport touring 3.0 5dr. 1 previous owner,waterford
bmw x1 (m sport),15203.00,2024-03-03,2014,48819,suv,automatic,petrol,silver bmw x1. 2.0 xdrive20i m sport 5d 181 bhp,dublin
bmw 3 series (318d),11154.00,2024-03-05,2017,82221,saloon,manual,diesel,black bmw 3 series. 2.0 318d sport euro 6 (s/s) 4dr. 1 previous owner,kildare
bmw x5 m (biturbo v8),37485.00,06/03/2024,2016,71735,suv,automatic,petrol,silver bmw x5 m. 4.4 biturbo auto xdrive (s/s) 5dr,dublin
bmw m5 (v8),48459.00,08/03/2024,2018,50130,saloon,automatic,petrol,grey bmw m5. 4.4 v8 steptronic xdrive euro 6 (s/s) 4dr,kilkenny
bmw x1 (18d),11282.00,09/03/2024,2018,124191,suv,manual,diesel,silver bmw x1. 2.0 18d se sdrive euro 6 (s/s) 5dr. 1 previous owner,cork
bmw x3 (xline),29989.00,09/03/2024,2017,21242,suv,automatic,diesel,red bmw x3. 2.0 20d xline auto xdrive euro 6 (s/s) 5dr. 2 previous owners,mayo
bmw 3 series (m sport),12228.00,2024-03-10,2013,54425,saloon,manual,petrol,red bmw 3 series. 2.0 320i xdrive m sport 4d 181 bhp rear parking sensors-ulez compliant,leitrim
bmw 3 series (320i),24104.00,12/03/2024,2018,27118,estate,automatic,petrol,black bmw 3 series. 320i xdrive m sport shadow edition 5dr step auto leather seats 2.0,mayo
bmw x6 (m sport),27843.00,2024-03-13,2015,66349,suv,automatic,diesel,red bmw x6. 3.0 xdrive40d m sport 4d auto 309 bhp fsh-tv-dvd-nav-cruise-dab-ac-+++,galway
bmw x5 m (competition),83072.00,2024-03-13,2020,17278,suv,automatic,petrol,blue bmw x5 m. m competition 4.4 5dr,mayo
bmw 1 series (120d),11431.00,14/03/2024,2016,63481,hatchback,manual,diesel,bmw 1 series. 2.0 120d m sport euro 6 (s/s) 3dr. 3 previous owners,limerick
bmw x3 (30d),28124.00,2024-03-15,2018,40461,suv,automatic,diesel,blue bmw x3. xdrive30d xline 3.0 5dr. 1 previous owner,meath
bmw 3 series (335d),22091.00,16/03/2024,2014,46173,saloon,automatic,diesel,red bmw 3 series. 335d xdrive m sport 3.0 4dr. 2 previous owners,dublin
bmw 3 series (318i),3442.00,17/03/2024,2008,104226,estate,manual,petrol,blue bmw 3 series. 2.0 318i edition es touring euro 4 5dr,wexford
bmw 5 series (m sport),16628,17/03/2024,2016,40205,saloon,automatic,diesel,black bmw 5 series. 2.0 518d m sport 4d 148 bhp | 14-days money back guarantee*. 2 previous owners,galway
bmw 3 series (320i),35290.00,18/03/2024,2022,4527,saloon,automatic,petrol,grey bmw 3 series. 320i m sport saloon 2.0 4dr. 1 previous owner,cavan
bmw x1 (m sport),20544.00,18/03/2024,2017,36301,suv,automatic,petrol,navy bmw x1. 2.0 20i m sport auto xdrive euro 6 (s/s) 5dr. 2 previous owners,tipperary
bmw 4 series (420d),25345.00,2024-03-18,2019,32463,coupe,automatic,diesel,blue bmw 4 series. 2.0 420d m sport auto euro 6 (s/s) 2dr. 3 previous owners,westmeath
bmw 4 series (mht),59013.00,2024-03-20,2022,2679,coupe,automatic,diesel hybrid,black bmw 4 series. m440d xdrive coupe 3.0 2dr. 1 previous owner,kildare
bmw 1 series (116d ed),4872.00,21/03/2024,2012,57262,hatchback,manual,diesel,blue bmw 1 series. 1.6 116d ed efficientdynamics euro 5 (s/s) 5dr. 5 previous owners,dublin
bmw x7 (mht),71196.00,22/03/2024,2021,7581,suv,automatic,diesel hybrid,bmw x7. x7 xdrive40d m sport 3.0 5dr. 1 previous owner,dublin
bmw 5 series (mht),29877.00,24/03/2024,2020,21565,saloon,automatic,diesel hybrid,silver bmw 5 series. 520d m sport saloon 2.0 4dr. 1 previous owner,kerry
bmw 3 series (se),10984.00,25/03/2024,2009,74317,coupe,manual,petrol,black bmw 3 series. 3.0 335i se euro 4 2dr. 5 previous owners,limerick
bmw 6 series (640d),17349.00,25/03/2024,2014,58284,coupe,automatic,diesel,silver bmw 6 series. 3.0 640d m sport auto euro 5 (s/s) 2dr. 2 previous owners,cork
bmw 4 series (m sport),19701.00,26/03/2024,2018,41348,coupe,automatic,diesel,silver bmw 4 series. 420d [190] m sport 2dr auto [professional media] 2.0. 3 previous owners,clare
bmw i3 (s),37230.00,27/03/2024,2022,478,hatchback,automatic,electric,grey bmw i3. 135kw s 33kwh 5dr auto [suite interior world],kilkenny
bmw 3 series (320i),15226.00,28/03/2024,2013,57231,saloon,manual,petrol,blue bmw 3 series. 2.0 320i xdrive m sport 4d 181 bhp,dublin
bmw m5 (v8),24989.00,28/03/2024,2012,60129,saloon,automatic,petrol,red bmw m5. 4.4 v8 dct euro 5 (s/s) 4dr. 3 previous owners,dublin
bmw 3 series (se),3922,2024-03-30,2009,130157,estat,manual,diesel,silver bmw 3 series. 2.0 320d se touring euro 5 5dr. 3 previous owners,galway
bmw 1 series (116d),13848.00,30/03/2024,2018,31243,hatchback,manual,diesel,silver bmw 1 series. 1.5 116d se business 5d 114 bhp park sensors~d.a.b.~blue tooth,offaly
bmw x5 (30d),51437.00,30/03/2024,2019,15439,suv,automatic,diesel,bmw x5 series. x5 xdrive30d m sport 3.0 5dr. 1 previous owner,tipperary
bmw 1 series (118d),7629,31/03/2024,2012,78369,coupe,manual,diesel,red bmw 1 series. 2.0 118d sport plus edition euro 5 (s/s) 2dr. 2 previous owners,dublin
bmw m3 (iv8),20768.00,01/04/2024,2009,65235,coupe,automatic,petrol,bmw m3. 4.0 iv8 dct euro 4 2dr. 5 previous owners,dublin
bmw 3 series (sport),13045.00,2024-04-01,2018,62756,saloon,manual,petrol,black bmw 3 series. 1.5 318i sport saloon 4dr petrol manual euro 6 (s/s) (136 ps). 3 previous owners,kildare
bmw 5 series (m sport),17899.00,02/04/2024,2016,33890,saloon,automatic,diesel,blue bmw 5 series. 520d [190] m sport 4dr step auto 2.0,louth
bmw 2 series (218d),11149.00,02/04/2024,2015,33478,coupe,manual,diesel,bmw 2 series. 2.0 218d se euro 6 (s/s) 2dr,dublin
bmw 1 series (sport plus edition),7637,02/04/2024,2013,82255,convertible,manual,diesel,blue bmw 1 series. 2.0 118d sport plus edition 2dr. 4 previous owners,wicklow
bmw 4 series (420d),40248.00,04/04/2024,2021,8196,convertible,automatic,diesel hybrid,bmw 4 series. 420d m sport convertible 2.0 2dr. 1 previous owner,dublin
bmw x7 (40i),69884.00,05/04/2024,2020,26725,suv,automatic,petrol,blue bmw x7. x7 xdrive40i m sport 3.0 5dr. 1 previous owner,dublin
bmw 6 series (630i),6959.00,06/04/2024,2009,130781,coupe,automatic,petrol,bmw 6 series. 3.0 630i sport coupe 2dr petrol steptronic euro 4 (272 ps). 5 previous owners,cork
bmw 3 series (335d),16961.00,07/04/2024,2015,107055,saloon,automatic,diesel,blue bmw 3 series. 3.0 335d m sport auto xdrive euro 6 (s/s) 4dr,kerry
bmw x6 (30d),70477,07/04/2024,2022,4336,suv,automatic,diesel hybrid,black bmw x6 series. x6 xdrive30d m sport 3.0 5dr. 1 previous owner,louth
bmw ix (40),71186.00,2024-04-08,2021,2889,suv,automatic,electric,grey bmw ix. 240kw xdrive40 m sport 76.6kwh 5dr auto,dublin
bmw 1 series (shadow edition),24569.00,08/04/2024,2019,29716,hatchback,automatic,petrol,bmw 1 series. m140i shadow edition 5dr step auto 3.0. 1 previous owner,dublin
bmw 6 series (m sport),17342.00,10/04/2024,2014,86364,convertible,automatic,diesel,red bmw 6 series. 3.0 640d m sport auto euro 5 (s/s) 2dr,cork
bmw i3 (s),37051.00,10/04/2024,2022,5292,hatchback,automatic,electric,bmw i3 series. i3s 120ah 5dr. 1 previous owner,meath
bmw 5 series (530d),9321.00,11/04/2024,2013,128350,estate,automatic,diesel,red bmw 5 series. 3.0 530d se touring auto euro 5 (s/s) 5dr,mayo
bmw m4 (biturbo),46445.00,12/04/2024,2019,5703,convertible,automatic,petrol,black bmw m4. competition 3.0 2dr. 2 previous owners,kildare
bmw 2 series (218d),17883.00,2024-04-13,2018,19398,convertible,manual,diesel,blue bmw 2 series. 2l sport 218d 2dr,dublin
bmw 1 series (sport plus edition),5960.00,15/04/2024,2013,108740,coupe,manual,diesel,red bmw 1 series. 2.0 118d sport plus edition euro 5 (s/s) 2dr. 1 previous owner,meath
bmw 1 series (edition es),4728.00,17/04/2024,2008,68343,hatchback,manual,diesel,bmw 1 series. 2.0 118d edition es euro 4 3dr. 1 previous owner,mayo
bmw 4 series (m440d),59031.00,18/04/2024,2022,1648,convertible,automatic,diesel hybrid,black bmw 4 series. m440d xdrive convertible 3.0 2dr. 1 previous owner,tipperary
bmw m2 (biturbo),46078.00,21/04/2024,2020,16747,coupe,automatic,petrol,silver bmw m2 series. m2 competition 3.0 2dr. 3 previous owners,waterford
bmw 4 series gran coupe (430i),24927.00,23/04/2024,2019,24061,hatchback,automatic,petrol,grey bmw 4 series gran coupe. 430i m sport gran coupe auto 2.0 5dr. 2 previous owners,dublin
bmw x1 (m sport),10887.00,25/04/2024,2012,71610,suv,automatic,diesel,blue bmw x1. 2.0 xdrive20d m sport 5d 181 bhp,cork
bmw 1 series (118i),17819.00,01/05/2024,2019,22971,hatchback,automatic,petrol,black bmw 1 series. 1.5 118i gpf sport hatchback 5dr petrol auto euro 6 (s/s) (136 ps). 2 previous owners,meath
bmw x6 (35d),11488.00,01/05/2024,2008,77037,suv,auto,diesel,silver bmw x6. 3.0 35d steptronic xdrive euro 4 5dr,dublin
bmw m2 (i),32810.00,02/05/2024,2016,17771,coupe,automatic,petrol,bmw m2. 3.0 m2 2d 365 bhp parking sensors! full bmw history!,wexford
bmw 1 series (m sport shadow edition),13613,2024-05-05,2019,31478,hatchback,manual,petrol,grey bmw 1 series. 1.5 118i gpf m sport shadow edition euro 6 (s/s) 5dr. 2 previous owners,cork
bmw x1 (se),9292.00,05/05/2024,2010,62167,suv,automatic,diesel,black bmw x1. 2.0 xdrive20d se 5d 174 bhp. 2 previous owners,dublin
bmw 5 series (luxury),11206,12/05/2024,2015,137453,saloon,automatic,diesel,silver bmw 5 series. 3.0 530d luxury auto euro 6 (s/s) 4dr. 2 previous owners,meath
bmw 1 series (116i),5453.00,13/05/2024,2011,130483,hatchback,manual,petrol,silver bmw 1 series. 1.6 116i urban edrive 5dr,clare
bmw 8 series (840i),60140.00,13/05/2024,2022,4641,coupe,automatic,petrol,grey bmw 8 series. 840i coupe 3.0 2dr. 1 previous owner,wexford
bmw 3 series (mht),30894.00,2024-05-13,2020,28538,estate,automatic,diesel hybrid,bmw 3 series. 320d m sport touring 2.0 5dr. 2 previous owners,kilkenny
bmw 2 series gran coupe (218i),27676,14/05/2024,2021,10003,saloon,manual,petrol,black bmw 2 series. 218i m sport gran coupe 1.5 4dr. 1 previous owner,louth
bmw 5 series (520d),7746.00,2024-05-14,2011,114916,saloon,automatic,diesel,bmw 5 series. 2.0 520d m sport steptronic euro 5 (s/s) 4dr. 5 previous owners,waterford
bmw x3 (20d),23256.00,15/05/2024,2016,37525,suv,automatic,diesel,blue bmw x3 series. x3 xdrive20d m sport 2.0 5dr. 2 previous owners,louth
bmw m3 (competition m),78236.00,16/05/2024,2021,8054,saloon,automatic,petrol,red bmw m3. 3.0 biturbo competition steptronic xdrive euro 6 (s/s) 4dr,kildare
bmw m8 gran coupe (competition),81258,18/05/2024,2021,20105,saloon,automatic,petrol,blue bmw m8 gran coupe. 4.4i v8 competition steptronic 4wd euro 6 (s/s) 4dr,dublin
bmw 5 series (530e),53690.00,19/05/2024,2022,2699,estate,automatic,petrol plug-in hybrid,blue bmw 5 series. 530e m sport touring 2.0 5dr. 1 previous owner,kerry
bmw x3 (se),7642.00,2024-05-19,2010,102738,suv,manual,diesel,red bmw x3. 2.0 20d se xdrive euro 5 (s/s) 5dr,offaly
bmw x3 m (competition),52372.00,2024-05-20,2020,13351,suv,automatic,petrol,silver bmw x3. 3.0 m competition 5d 503 bhp \xa33735 of factory fitted extras,dublin
bmw 4 series (m sport),15772,21/05/2024,2017,118034,coupe,automatic,diesel,bmw 4 series. 430d xdrive m sport 2dr auto (digital cockpit) [professional media] (full leather+sat nav) 3.0,dublin
bmw 3 series (320d),9120,21/05/2024,2013,101994,saloon,automatic,diesel,black bmw 3 series. 2.0 320d luxury (s/s) 4dr,carlow
bmw 1 series (m sport),11196.00,22/05/2024,2009,132978,coupe,manual,petrol,red bmw 1 series. 3.0 135i m sport euro 4 2dr. 5 previous owners,galway
bmw 3 series (m340i),44892.00,22/05/2024,2021,11896,saloon,automatic,petrol hybrid,blue bmw 3 series. m340i xdrive saloon 3.0 4dr. 1 previous owner,dublin
bmw 6 series (635d),7171.00,23/05/2024,2008,113838,coupe,automatic,diesel,bmw 6 series. 3.0 635d sport steptronic euro 4 2dr. 4 previous owners,limerick
bmw 6 series (m sport),15683.00,23/05/2024,2013,79608,convertible,automatic,diesel,silver bmw 6 series. 3.0 640d m sport auto euro 5 (s/s) 2dr. 3 previous owners,waterford
bmw 1 series (116d),13943,23/05/2024,2019,51721,hatchback,manual,diesel,blue bmw 1 series. 116d se business 5-door 1.5 5dr. 2 previous owners,kerry
bmw 5 series (se),18295.00,24/05/2024,2017,85533,estate,automatic,diesel,grey bmw 5 series. 2.0 520d se touring auto xdrive (s/s) 5dr. 1 previous owner,westmeath
bmw 1 series (118i),17241.00,25/05/2024,2019,29929,hatchback,automatic,petrol,red bmw 1 series. 1.5 118i gpf sport hatchback 5dr petrol auto euro 6 (s/s) (136 ps). 1 previous owner,mayo
bmw 5 series (se),5711.00,25/05/2024,2011,145683,saloon,manual,diesel,blue bmw 5 series. 2.0 520d se euro 5 4dr. 3 previous owners,dublin
bmw 5 series (m sport),19220,25/05/2024,2015,67179,saloon,automatic,diesel,black bmw 5 series. 3.0 535d m sport 4d 309 bhp * m sport plus pack * professional media pack * harmon/kardon sound * concierge service * xenon lights * parking aid * pri. 2 previous owners,dublin
bmw 4 series gran coupe (m sport),19314.00,26/05/2024,2017,101430,hatchback,automatic,petrol,grey bmw 4 series gran coupe. 3.0 440i m sport auto euro 6 (s/s) 5dr. 2 previous owners,dublin
bmw 2 series gran coupe (218i),25708.00,28/05/2024,2021,9305,saloon,manual,petrol,black bmw 2 series. 218i sport gran coupe 1.5 4dr. 1 previous owner,louth
bmw 5 series (mht),60126.00,28/05/2024,2022,5080,estat,automatic,diesel hybrid,blue bmw 5 series. 530d xdrive m sport touring 3.0 5dr,roscommon
bmw x1 (20d),12053,2024-05-29,2013,58148,suv,automatic,diesel,navy bmw x1. 2.0 20d m sport auto xdrive euro 5 (s/s) 5dr,louth
bmw 4 series gran coupe (420d),22098.00,2024-05-30,2017,35021,hatchback,automatic,diesel,blue bmw 4 series gran coupe. 2.0 420d m sport auto euro 6 (s/s) 5dr. 2 previous owners,dublin
bmw 5 series (530e),48431.00,31/05/2024,2022,4547,saloon,automatic,petrol plug-in hybrid,bmw 5 series. 530e m sport saloon 2.0 4dr. 1 previous owner,sligo
bmw x1 (18d),22243.00,31/05/2024,2018,33288,suv,automatic,diesel,bmw x1 series. x1 xdrive18d m sport 2.0 5dr. 2 previous owners,cork
bmw 5 series (520d),4447.00,01/06/2024,2011,180229,estate,automatic,diesel,bmw 5 series. 2.0 520d se touring steptronic euro 5 5dr. 4 previous owners,westmeath
bmw x5 (40i),69467.00,01/06/2024,2022,4902,suv,automatic,petrol hybrid,navy bmw x5. 3.0 40i mht m sport auto xdrive euro 6 (s/s) 5dr. 1 previous owner,dublin
bmw x4 (m sport),48931.00,2024-06-03,2021,14399,suv,automatic,diesel hybrid,bmw x4. xdrive30d mht m sport 5dr auto 3.0,louth
bmw x3 (30d),19847.00,04/06/2024,2015,51006,suv,automatic,diesel,red bmw x3. xdrive30d xline 5dr step auto 3.0,dublin
bmw x6 (30d),27159.00,04/06/2024,2015,54284,suv,automatic,diesel,blue bmw x6 series. x6 xdrive30d m sport 3.0 5dr. 3 previous owners,dublin
bmw 5 series (520d),6237.00,2024-06-06,2012,163090,saloon,manual,diesel,silver bmw 5 series. 2.0 520d se (s/s) 4dr. 4 previous owners,cork
bmw x4 (30d),18342.00,06/06/2024,2015,93956,suv,automatic,diesel,"red bmw x4. 3.0 xdrive30d m sport 4d auto 255 bhp media pack, rear cam, automatic. 2 previous owners",dublin
bmw 5 series (m sport),16452.00,06/06/2024,2015,97281,saloon,automatic,diesel,blue bmw 5 series. 3.0 535d m sport auto euro 6 (s/s) 4dr. 2 previous owners,tipperary
bmw 1 series (sport),6190.00,07/06/2024,2013,112316,hatchback,manual,petrol,red bmw 1 series. 1.6 114i sport euro 6 (s/s) 5dr. 3 previous owners,dublin
bmw x1 (m sport),20403.00,09/06/2024,2018,44518,suv,automatic,diesel,bmw x1. xdrive 18d m sport 5dr step auto 2.0,cork
bmw 3 series (sport),24080.00,09/06/2024,2019,21191,saloon,manual,diesel,bmw 3 series. 2.0 320d sport saloon 4dr diesel manual euro 6 (s/s) (190 ps). 1 previous owner,dublin
bmw m4 (biturbo),76421.00,10/06/2024,2022,5081,coupe,auto,petrol,black bmw m4 series. m4 competition m xdrive coupe 3.0 2dr. 1 previous owner,waterford
bmw x3 (20d),9085.00,12/06/2024,2012,104788,s.u.v.,automatic,diesel,bmw x3. 2.0 20d se auto xdrive euro 5 (s/s) 5dr,waterford
bmw x5 (40d),11004.00,12/06/2024,2011,99996,suv,automatic,diesel,grey bmw x5. 3.0 40d m sport steptronic xdrive euro 5 5dr. 4 previous owners,louth
bmw 5 series gran turismo (530d),14536.00,12/06/2024,2012,29043,hatchback,automatic,diesel,grey bmw 5 series gran turismo. 3.0 530d se gt steptronic euro 5 5dr. 2 previous owners,meath
bmw 3 series (330d),10263.00,13/06/2024,2013,87163,saloon,automatic,diesel,blue bmw 3 series. 3.0 330d m sport sport auto (s/s) 4dr. 4 previous owners,dublin
bmw 3 series (sport),16624,13/06/2024,2018,53332,saloon,automatic,petrol,grey bmw 3 series. 320i sport 4dr step auto 2.0,dublin
bmw 3 series (ed plus),11850.00,14/06/2024,2016,89854,saloon,automatic,diesel,blue bmw 3 series. 2.0 320d ed plus auto euro 6 (s/s) 4dr. 2 previous owners,wicklow
bmw m4 (competition),40661.00,15/06/2024,2019,16023,coupe,automatic,petrol,red bmw m4 series. m4 coupe competition package 3.0 2dr. 1 previous owner,cavan
bmw m6 gran coupe (v8),37252.00,16/06/2024,2017,37731,saloon,automatic,petrol,bmw m6. 4.4 gran coupe 4d 573 bhp,dublin
bmw x5 (30d),46597.00,17/06/2024,2019,21433,suv,automatic,diesel,red bmw x5 series. x5 xdrive30d m sport 3.0 5dr. 1 previous owner,cork
bmw 3 series (mht),36166.00,17/06/2024,2021,3920,saloon,automatic,diesel hybrid,black bmw 3 series. 320d m sport saloon 2.0 4dr. 1 previous owner,dublin
bmw 4 series gran coupe (420d),18855.00,2024-06-19,2018,48662,hatchback,automatic,diesel,red bmw 4 series. 420d gran coupe m sport auto 2.0 5dr,kildare
bmw 1 series (116d),10593.00,19/06/2024,2016,72165,hatchback,manual,diesel,blue bmw 1 series. 1.5 116d sport euro 6 (s/s) 5dr. 4 previous owners,dublin
bmw 8 series gran coupe (mht),54885.00,20/06/2024,2021,5377,saloon,automatic,diesel hybrid,black bmw 8 series. 840d xdrive m sport gran coupe 3.0 4dr. 1 previous owner,dublin
bmw 1 series (m140i),24922.00,21/06/2024,2019,25297,hatchback,automatic,petrol,black bmw 1 series. m140i shadow edition step auto 3.0 5dr,dublin
bmw m4 (biturbo),40062.00,21/06/2024,2018,20097,convertible,automatic,petrol,red bmw m4 series. m4 convertible competition package 3.0 2dr. 2 previous owners,limerick
bmw 3 series (m sport shadow edition),24410.00,2024-06-24,2018,20421,saloon,automatic,petrol,red bmw 3 series. 2.0 320i m sport shadow edition auto euro 6 (s/s) 4dr. 1 previous owner,laois
bmw x1 (m sport),20543.00,24/06/2024,2017,26487,suv,automatic,diesel,bmw x1. 2.0 25d m sport auto xdrive (s/s) 5dr. 1 previous owner,cork
bmw 5 series (520d),14028.00,24/06/2024,2016,68960,saloon,automatic,diesel,red bmw 5 series. 2.0 520d se auto euro 6 (s/s) 4dr. 1 previous owner,dublin
bmw 1 series (120i),16148.00,24/06/2024,2018,50404,hatchback,automatic,petrol,black bmw 1 series. 2.0 120i gpf m sport shadow edition auto euro 6 (s/s) 5dr. 4 previous owners,donegal
bmw x1 (xline),18249.00,26/06/2024,2016,45456,suv,automatic,diesel,navy bmw x1. 2.0 20d xline auto xdrive (s/s) 5dr,dublin
bmw 1 series (m140i),26614.00,27/06/2024,2018,23886,hatchback,automatic,petrol,black bmw 1 series. m140i shadow edition 5-door 3.0 5dr. 1 previous owner,tipperary
bmw 3 series (m sport shadow edition),21276.00,27/06/2024,2019,46137,estate,automatic,petrol,black bmw 3 series. 2.0 320i m sport shadow edition touring auto euro 6 (s/s) 5dr. 2 previous owners,dublin
bmw 3 series (330e),9213.00,2024-06-28,2016,140107,saloon,automatic,petrol plug-in hybrid,red bmw 3 series. 2.0 330e 7.6kwh m sport auto euro 6 (s/s) 4dr. 2 previous owners,dublin
bmw 3 series (m sport),5934.00,30/06/2024,2009,104332,convertible,auto,petrol,red bmw 3 series. 3.0 330i m sport 2dr. 5 previous owners,monaghan
bmw 3 series (320d),11897.00,01/07/2024,2014,66689,saloon,automatic,diesel,silver bmw 3 series. 2.0 320d m sport saloon 4dr diesel auto euro 5 (s/s) (184 ps). 4 previous owners,cork
bmw 5 series (se),8707.00,01/07/2024,2012,167185,saloon,auto,diesel,grey bmw 5 series. 3.0 530d se auto euro 5 (s/s) 4dr. 3 previous owners,meath
bmw 1 series (118i),12089.00,2024-07-02,2016,64897,hatchback,manual,petrol,navy bmw 1 series. 1.5 118i sport hatchback 5dr petrol manual euro 6 (s/s) (136 ps). 1 previous owner,kildare
bmw x3 (20d),5269.00,02/07/2024,2009,111432,suv,manual,diesel,red bmw x3. 2.0 20d m sport xdrive 5dr. 4 previous owners,wicklow
bmw x1 (m sport),20969.00,03/07/2024,2017,35831,suv,automatic,petrol,bmw x1 series. x1 xdrive20i m sport 2.0 5dr. 2 previous owners,dublin
bmw 4 series gran coupe (420i),25308.00,03/07/2024,2020,16712,hatchback,automatic,petrol,navy bmw 4 series gran coupe. 420i m sport gran coupe 2.0 5dr. 2 previous owners,monaghan
bmw 5 series (530i),27304.00,03/07/2024,2019,20902,saloon,automatic,petrol,blue bmw 5 series. 2.0 530i gpf m sport auto euro 6 (s/s) 4dr. 1 previous owner,cork
bmw m4 (competition),33512.00,2024-07-03,2016,35881,coupe,automatic,petrol,blue bmw m4. 3.0 biturbo competition dct euro 6 (s/s) 2dr. 3 previous owners,dublin
bmw 1 series (sport),9160,10/07/2024,2014,55079,hatchback,manual,petrol,red bmw 1 series. 1.6 116i sport euro 6 (s/s) 5dr. 3 previous owners,tipperary
bmw 6 series (sport),8875.00,10/07/2024,2008,92158,convertible,automatic,diesel,grey bmw 6 series. 3.0 635d sport steptronic euro 4 2dr,dublin
bmw 5 series (se),8957.00,11/07/2024,2013,94906,estate,automatic,diesel,bmw 5 series. 2.0 520d se touring auto euro 5 (s/s) 5dr. 2 previous owners,wexford
bmw 1 series (118d),13290.00,12/07/2024,2015,37773,hatchback,automatic,diesel,black bmw 1 series. 2.0 118d sport 5d auto 147 bhp,dublin
bmw 3 series (320d),9144.00,2024-07-14,2014,95571,saloon,manual,diesel,blue bmw 3 series. 2.0 320d sport euro 5 (s/s) 4dr. 4 previous owners,laois
bmw x3 (se),16224.00,15/07/2024,2015,70942,suv,automatic,diesel,bmw x3. 2.0 20d se auto xdrive euro 6 (s/s) 5dr,kildare
bmw 5 series (luxury),14277.00,2024-07-16,2014,51236,estate,automatic,diesel,black bmw 5 series. 2.0 520d luxury touring auto euro 6 (s/s) 5dr,roscommon
bmw 2 series (sport),16760.00,18/07/2024,2018,50695,convertible,manual,petrol,navy bmw 2 series. 1.5 218i sport euro 6 (s/s) 2dr. 4 previous owners,galway
bmw i3 (s),29198.00,2024-07-18,2019,19115,hatchback,automatic,electric,black bmw i3 series. i3s 120ah 5dr. 1 previous owner,wexford
bmw 3 series (se),2922.00,2024-07-18,2008,99310,saloon,manual,diesel,blue bmw 3 series. 2.0 318d se euro 4 4dr,kildare
bmw 2 series (218i),16570.00,19/07/2024,2018,34901,coupe,manual,petrol,navy bmw 2 series. 218i m sport 2dr [nav] 1.5,louth
bmw x5 (30d),17125.00,19/07/2024,2014,141007,suv,automatic,diesel,blue bmw x5. 3.0 30d m sport auto xdrive euro 6 (s/s) 5dr. 2 previous owners,wexford
bmw 1 series (sport),12673.00,19/07/2024,2014,35248,hatchback,automatic,petrol,bmw 1 series. 1.6 116i sport auto euro 5 (s/s) 5dr. 2 previous owners,dublin
bmw alpina d3 (lux),9700.00,21/07/2024,2011,157270,saloon,automatic,diesel,silver bmw alpina. d3 2.0 bi turbo 4dr switch-tronic (lux pack)(number 419/431)(rear parking s,waterford
bmw 7 series (730d),7921.00,22/07/2024,2008,111076,saloon,automatic,diesel,navy bmw 7 series. 3.0 730d se carbon exclusive edition saloon 4dr diesel auto euro 4 (231 ps). 3 previous owners,louth
bmw i3 (s),32042.00,22/07/2024,2021,5094,hatchback,automatic,electric,red bmw i3 series. i3s 120ah 5dr. 1 previous owner,donegal
bmw 3 series (m sport),10332.00,25/07/2024,2010,133497,estate,automatic,diesel,black bmw 3 series. 3.0 335d m sport touring steptronic euro 5 5dr,dublin
bmw 4 series gran coupe (m sport),16856.00,27/07/2024,2014,52065,hatchback,automatic,diesel,black bmw 4 series. 420d xdrive m sport 5dr auto leather seats 2.0,kerry
bmw x5 (25d),17959.00,2024-07-27,2014,94109,suv,automatic,diesel,blue bmw x5. 2.0 xdrive25d se 5d 215 bhp 12 months warranty included,dublin
bmw m4 (biturbo),23798.00,2024-07-29,2017,124211,convertible,automatic,petrol,silver bmw m4. 3.0 biturbo dct euro 6 (s/s) 2dr,dublin
bmw 4 series (420i),38081.00,30/07/2024,2021,13337,coupe,automatic,petrol,silver bmw 4 series. 420i m sport coupe 2.0 2dr. 1 previous owner,limerick
bmw 1 series (sport),10894.00,30/07/2024,2017,78127,hatchback,automatic,diesel,silver bmw 1 series. 1.5 116d sport auto euro 6 (s/s) 5dr. 2 previous owners,cork
bmw x1 (18i),19563.00,31/07/2024,2018,40740,suv,manual,petrol,silver bmw x1 series. x1 sdrive18i xline 1.5 5dr. 1 previous owner,kerry
bmw m4 (biturbo),28703.00,01/08/2024,2015,48346,convertible,automatic,petrol,red bmw m4 series. m4 convertible 3.0 2dr. 4 previous owners,louth
bmw 1 series (m135i),34403.00,2024-08-01,2020,14510,hatchback,automatic,petrol,black bmw 1 series. m135i xdrive 2.0 5dr. 2 previous owners,dublin
bmw 1 series (sport),5948.00,02/08/2024,2011,39363,hatchback,manual,diesel,black bmw 1 series. 2.0 116d sport euro 4 5dr. 4 previous owners,dublin
bmw ix (m sport),78208.00,2024-08-02,2022,1525,suv,automatic,electric,bmw i series. ix xdrive40 m sport 5dr. 1 previous owner,dublin
bmw x2 (se),17475.00,03/08/2024,2019,47450,suv,manual,diesel,black bmw x2. 2.0 sdrive18d se 5dr,wexford
bmw 5 series (luxury),12740.00,05/08/2024,2014,66398,saloon,automatic,diesel,grey bmw 5 series. 520d [190] luxury 4dr step auto low mileage 2.0. 1 previous owner,sligo
bmw ix (40),70175.00,06/08/2024,2021,6451,suv,automatic,electric,grey bmw i series. ix xdrive40 sport 5dr. 1 previous owner,meath
bmw 3 series (m sport),10628.00,06/08/2024,2014,123411,saloon,automatic,diesel,bmw 3 series. 2.0 320d m sport saloon 4dr diesel auto euro 5 (s/s) (184 ps). 1 previous owner,dublin
bmw 1 series (se),10368.00,2024-08-07,2016,54272,hatchback,manual,petrol,black bmw 1 series. 1.5 118i se euro 6 (s/s) 5dr. 2 previous owners,kerry
bmw 5 series (530d),45376.00,2024-08-08,2022,10983,saloon,automatic,diesel hybrid,red bmw 5 series. 530d xdrive m sport saloon 3.0 4dr. 1 previous owner,sligo
bmw 3 series (320d),9543.00,09/08/2024,2013,102939,saloon,manual,diesel,black bmw 3 series. 2.0 320d m sport euro 5 (s/s) 4dr. 1 previous owner,dublin
bmw 3 series (335i),12198.00,09/08/2024,2012,111016,coupe,manual,petrol,black bmw 3 series. 3.0 335i sport plus edition euro 5 2dr. 2 previous owners,dublin
bmw x6 (m sport),36218.00,11/08/2024,2016,15992,s.u.v.,automatic,diesel,bmw x6. 3.0 40d m sport suv 5dr diesel auto xdrive euro 6 (s/s) (313 ps). 2 previous owners,cork
bmw x5 (30d),51842.00,11/08/2024,2019,21016,s.u.v.,automatic,diesel,grey bmw x5 series. x5 xdrive30d m sport 3.0 5dr. 1 previous owner,kildare
bmw 1 series (se),19321.00,12/08/2024,2019,6405,hatchback,automatic,petrol,blue bmw 1 series. 118i [1.5] se 5dr [nav/servotronic] step auto,tipperary
bmw 5 series (se),12835.00,2024-08-13,2014,65763,saloon,automatic,diesel,blue bmw 5 series. 2.0 520d se auto euro 6 (s/s) 4dr. 2 previous owners,dublin
bmw 1 series (m140i),21890.00,17/08/2024,2018,61934,hatchback,automatic,petrol,black bmw 1 series. 3.0 m140i shadow edition auto euro 6 (s/s) 5dr. 2 previous owners,galway
bmw 3 series (330i),28123.00,17/08/2024,2020,31470,saloon,automatic,petrol,red bmw 3 series. 330i m sport 4dr step auto 2.0,meath
bmw 1 series (118d),17408.00,18/08/2024,2016,28020,hatchback,automatic,diesel,black bmw 1 series. bmw 1 118d 2.0 m sport 5dr auto pronav comfort pack leather. 3 previous owners,sligo
bmw m5 (i v8),55361.00,18/08/2024,2018,31580,saloon,automatic,petrol,grey bmw m5 series. bmw m5 competition saloon 4.4 4dr. 3 previous owners,donegal
bmw 1 series (118d),2845.00,18/08/2024,2009,118408,hatchback,manual,diesel,grey bmw 1 series. 2.0 118d es euro 5 5dr. 4 previous owners,dublin
bmw 5 series (se),5739,2024-08-19,2012,127248,saloon,manual,diesel,black bmw 5 series. 2.0 520d se saloon 4dr diesel manual euro 5 (s/s) (184 ps). 3 previous owners,cork
bmw 1 series (m sport),9259.00,19/08/2024,2015,97120,hatchback,manual,diesel,black bmw 1 series. 2.0 118d m sport euro 5 (s/s) 5dr. 1 previous owner,cork
bmw x5 (30d),26243.00,19/08/2024,2016,79745,suv,automatic,diesel,grey bmw x5. 3.0 30d m sport suv 5dr diesel auto xdrive euro 6 (s/s) (258 ps). 1 previous owner,waterford
bmw x3 (20d),5441.00,20/08/2024,2010,110032,suv,automatic,diesel,grey bmw x3. 2.0 20d m sport steptronic xdrive euro 5 5dr,wexford
bmw x3 (m sport),17944.00,20/08/2024,2013,61360,suv,automatic,diesel,grey bmw x3. 3.0 35d m sport auto xdrive euro 5 (s/s) 5dr,dublin
bmw 3 series (m sport shadow edition),27553.00,20/08/2024,2018,29842,saloon,automatic,petrol,silver bmw 3 series. 340i m sport shadow edition saloon at 3.0 4dr. 2 previous owners,cork
bmw m5 (competition),82214.00,20/08/2024,2021,4105,saloon,automatic,petrol,silver bmw m5 series. m5 competition saloon 4.4 4dr. 1 previous owner,offaly
bmw x5 (m sport),23224.00,22/08/2024,2014,93327,suv,auto,diesel,black bmw x5. 3.0 40d m sport auto xdrive euro 6 (s/s) 5dr,longford
bmw 1 series (sport),11091.00,22/08/2024,2015,71082,hatchback,automatic,diesel,blue bmw 1 series. 2.0 120d sport auto euro 6 (s/s) 5dr,kildare
bmw x4 (m sport),35206.00,22/08/2024,2019,22751,suv,automatic,diesel,red bmw x4 series. x4 xdrive20d m sport 2.0 5dr. 1 previous owner,limerick
bmw 3 series (320i),16939,22/08/2024,2018,53355,saloon,automatic,petrol,red bmw 3 series. 320i sport 4dr step auto 2.0,dublin
bmw 3 series gran turismo (320i),9475.00,22/08/2024,2013,106019,hatchback,manual,petrol,grey bmw 3 series gran turismo. 3 series gran turismo 320i m sport - navigation - reversing camera - leather - gt m sport 2.0 4dr hatchback manual petrol,dublin
bmw 4 series gran coupe (435d),18904.00,24/08/2024,2015,54324,hatchback,automatic,diesel,blue bmw 4 series gran coupe. 3.0 435d m sport hatchback 5dr diesel auto xdrive euro 6 (s/s) (313 ps). 1 previous owner,dublin
bmw x2 (m sport),25149.00,25/08/2024,2019,21376,suv,automatic,petrol,silver bmw x2 series. x2 sdrive20i m sport 2.0 5dr. 2 previous owners,tipperary
bmw x1 (m sport),9214.00,25/08/2024,2011,49213,suv,manual,diesel,grey bmw x1. 2.0 18d m sport xdrive 5dr. 3 previous owners,offaly
bmw 3 series gran turismo (m sport),12703.00,27/08/2024,2014,84376,hatchback,manual,petrol,silver bmw 3 series gran turismo. 2.0 320i m sport gt 5dr petrol manual xdrive euro 6 (s/s) (184 ps). 4 previous owners,louth
bmw 3 series (330d),10948.00,28/08/2024,2014,105182,saloon,auto,diesel,grey bmw 3 series. 3.0 330d m sport saloon 4dr diesel auto euro 5 (s/s) (258 ps),waterford
bmw x5 (sd),7361.00,29/08/2024,2008,146982,suv,automatic,diesel,black bmw x5. 3.0 sd m sport auto 4wd 5dr,tipperary
bmw 2 series (218i),13014.00,2024-09-01,2016,64686,coupe,manual,petrol,silver bmw 2 series. 1.5 218i m sport (s/s) 2dr. 1 previous owner,cork
bmw 4 series (420d),29828.00,2024-09-01,2019,18402,convertible,automatic,diesel,grey bmw 4 series. 420d m sport convertible 2.0 2dr. 1 previous owner,limerick
bmw 1 series (118i),14290.00,02/09/2024,2016,37701,hatchback,manual,petrol,grey bmw 1 series. 118i m sport 1.5 3dr. 3 previous owners,louth
bmw 4 series gran coupe (420d),38144.00,02/09/2024,2021,11611,hatchback,automatic,diesel hybrid,navy bmw 4 series gran coupe. 420d xdrive m sport gran coupe 2.0 5dr. 1 previous owner,dublin
bmw 3 series (330d),20372.00,03/09/2024,2016,48055,saloon,automatic,diesel,red bmw 3 series. 3.0 330d m sport auto xdrive euro 6 (s/s) 4dr,dublin
bmw x3 (m sport),42694.00,04/09/2024,2021,4587,suv,automatic,diesel hybrid,grey bmw x3 series. x3 xdrive20d m sport 2.0 5dr. 1 previous owner,dublin
bmw 2 series (218i),21133.00,04/09/2024,2019,10971,coupe,automatic,petrol,navy bmw 2 series. 218i sport coupe 1.5 2dr. 2 previous owners,cavan
bmw x5 (25d),23091.00,05/09/2024,2015,47724,suv,automatic,diesel,black bmw x5. 2.0 xdrive25d m sport 5d 231 bhp ulez+low mileage+ambient lighting,galway
bmw 5 series (m sport),11863.00,06/09/2024,2014,83310,saloon,automatic,diesel,navy bmw 5 series. 2.0 520d m sport 4d 188 bhp 2 keys ulez navigation bluetooth. 2 previous owners,roscommon
bmw 3 series (335d),20407.00,2024-09-06,2016,56418,saloon,automatic,diesel,grey bmw 3 series. 335d xdrive m sport 3.0 4dr,dublin
bmw 3 series (edition es),3392.00,07/09/2024,2008,104151,estate,manual,petrol,blue bmw 3 series. 2.0 318i edition es touring euro 4 5dr,dublin
bmw 2 series (220d),38456.00,08/09/2024,2022,10196,coupe,automatic,diesel hybrid,navy bmw 2 series. 220d m sport coupe 2.0 2dr. 1 previous owner,louth
bmw x1 (18d),11077.00,08/09/2024,2014,55180,suv,manual,diesel,blue bmw x1. 2.0 18d m sport xdrive euro 5 (s/s) 5dr,dublin
bmw x1 (m sport),17301.00,09/09/2024,2016,63652,suv,automatic,diesel,bmw x1. xdrive 20d m sport 5dr step auto estate 2.0. 1 previous owner,dublin
bmw 4 series (mht),43959,12/09/2024,2021,8364,coupe,automatic,diesel hybrid,bmw 4 series. 430d xdrive m sport coupe 3.0 2dr. 1 previous owner,roscommon
bmw z4 (20i),32287.00,14/09/2024,2020,13639,convertible,automatic,petrol,bmw z4 series. z4 sdrive20i m sport 2.0 2dr. 1 previous owner,waterford
bmw x2 (m sport),24820.00,15/09/2024,2019,13448,suv,automatic,petrol,silver bmw x2. sdrive 20i m sport 5dr step auto 2.0,dublin
bmw 3 series (330d),11298.00,16/09/2024,2012,98308,saloon,automatic,diesel,black bmw 3 series. 3.0 330d m sport auto euro 5 (s/s) 4dr. 3 previous owners,waterford
bmw m4 (competition),42908,2024-09-16,2018,15131,convertible,automatic,petrol,grey bmw m4. 3.0 biturbo competition dct euro 6 (s/s) 2dr. 2 previous owners,waterford
bmw x5 (se),10261.00,16/09/2024,2011,75398,suv,automatic,diesel,blue bmw x5. 3.0 30d se steptronic xdrive euro 5 5dr,carlow
bmw 3 series (sport),9399.00,18/09/2024,2016,110462,saloon,manual,diesel,blue bmw 3 series. 2.0 316d sport euro 6 (s/s) 4dr,kildare
bmw 5 series (520d),12589.00,20/09/2024,2013,57562,saloon,automatic,diesel,bmw 5 series. 2.0 520d se auto euro 6 (s/s) 4dr. 2 previous owners,limerick
bmw 3 series (318i),12552.00,21/09/2024,2015,38362,saloon,manual,petrol,blue bmw 3 series. 1.5 318i sport 4 door blue very low mileage bluetooth+dab+aux+usb+may 23 mot,dublin
bmw x6 m (competition),95369.00,21/09/2024,2021,14393,suv,automatic,petrol,black bmw x6 m. x6 m competition 4.4 5dr. 2 previous owners,louth
bmw x5 (m sport),11305.00,2024-09-23,2012,124432,suv,automatic,diesel,bmw x5. 3.0 30d m sport steptronic xdrive euro 5 5dr,meath
bmw 3 series (330i),29363.00,24/09/2024,2019,12207,saloon,automatic,petrol,grey bmw 3 series. 330i sport saloon 2.0 4dr. 1 previous owner,dublin
bmw x4 (m sport),48999.00,2024-09-24,2022,9579,suv,automatic,diesel hybrid,black bmw x4 diesel estate. xdrive20d mht m sport 5dr step auto 2.0. 1 previous owner,cork
bmw m3 (biturbo),48238.00,2024-09-26,2018,10290,saloon,manual,petrol,black bmw m3. 3.0 m3 competition package 4d 444 bhp individual atlantis blue. 2 previous owners,cork
bmw 4 series (420d),41905.00,27/09/2024,2021,5197,convertible,automatic,diesel hybrid,red bmw 4 series. 420d m sport convertible 2.0 2dr. 1 previous owner,tipperary
bmw x5 (40d),35155.00,28/09/2024,2018,68749,suv,automatic,diesel,silver bmw x5. 3.0 40d m sport auto xdrive euro 6 (s/s) 5dr. 3 previous owners,tipperary
bmw 3 series (m sport),11261.00,2024-09-28,2012,81345,saloon,automatic,petrol,black bmw 3 series. 2.0 320i m sport auto xdrive euro 5 (s/s) 4dr. 3 previous owners,longford
bmw m2 (competition),42588,29/09/2024,2019,19583,coupe,automatic,petrol,silver bmw m2 series. m2 competition 3.0 2dr. 1 previous owner,dublin
bmw 1 series (m sport),13210.00,2024-09-30,2016,57209,hatchback,manual,diesel,grey bmw 1 series. 2.0 118d m sport hatchback 3dr diesel manual euro 6 (s/s) (150 ps). 3 previous owners,offaly
bmw m2 (biturbo),35384.00,30/09/2024,2018,60454,coupe,automatic,petrol,silver bmw m2. 3.0 biturbo competition dct euro 6 (s/s) 2dr. 2 previous owners,donegal
bmw 1 series (performance edition),6234.00,2024-09-30,2011,68339,hatchback,manual,petrol,navy bmw 1 series. 2.0 116i performance edition euro 5 (s/s) 3dr,kildare
bmw z4 (m40i),37306.00,2024-10-01,2019,31511,convertible,automatic,petrol,black bmw z4. sdrive m40i 2dr auto 3.0,meath
bmw 1 series (116d),16142.00,01/10/2024,2017,56464,hatchback,automatic,diesel,blue bmw 1 series. 116d m sport shadow edition satnav harmon kardon 1.5 5dr. 3 previous owners,roscommon
bmw x3 (18d),10269.00,03/10/2024,2013,99412,suv,automatic,diesel,blue bmw x3. sdrive18d se 2.0 5dr,donegal
bmw 4 series (m sport),18124.00,03/10/2024,2014,72625,coupe,automatic,petrol,red bmw 4 series. 3.0 435i m sport 2d auto 302 bhp sat-nav+2 keys+s/history+warranty,dublin
bmw x3 (20d),13525.00,04/10/2024,2014,122338,suv,automatic,diesel,bmw x3. 2.0 20d m sport auto xdrive 5dr. 2 previous owners,carlow
bmw 4 series (420i),20396.00,2024-10-04,2019,16741,coupe,manual,petrol,bmw 4 series. 2.0 420i m sport 2dr,waterford
bmw 3 series (m sport highline),2939.00,05/10/2024,2010,89001,coupe,manual,petrol,bmw 3 series. 2.0 320i m sport highline euro 5 2dr. 4 previous owners,wicklow
bmw 1 series (ed plus),10873.00,05/10/2024,2017,69877,hatchback,manual,diesel,bmw 1 series. 1.5 116d ed plus euro 6 (s/s) 5dr. 2 previous owners,dublin
bmw 5 series (520d),8485.00,2024-10-06,2012,120525,estate,manual,diesel,silver bmw 5 series. 2.0 520d se touring 5dr diesel manual euro 5 (s/s) (184 ps). 2 previous owners,dublin
bmw x3 (20d),20239.00,06/10/2024,2016,50477,suv,automatic,diesel,red bmw x3. 2.0 xdrive20d m sport 5d 188 bhp nevada leather+electric seat+euro 6. 2 previous owners,dublin
bmw 1 series (sport plus edition),9498.00,07/10/2024,2012,59306,convertible,manual,petrol,grey bmw 1 series. 2.0 118i sport plus edition 2d 141 bhp nav + leather + 18in alloys,sligo
bmw 1 series (m135i),36783.00,08/10/2024,2021,8369,hatchback,automatic,petrol,black bmw 1 series. m135i xdrive 2.0 5dr. 2 previous owners,cork
bmw 2 series (218i),22116,2024-10-08,2020,7479,coupe,manual,petrol,navy bmw 2 series. 1.5 218i gpf m sport euro 6 (s/s) 2dr. 1 previous owner,kildare
bmw 3 series (m sport),10906.00,2024-10-10,2013,107751,saloon,automatic,diesel,red bmw 3 series. 3.0 330d m sport sport auto (s/s) 4dr. 5 previous owners,limerick
bmw 4 series gran coupe (420d),15096.00,10/10/2024,2017,49191,hatchback,manual,diesel,"navy bmw 4 series. 2.0 420d sport gran coupe 4d 188 bhp media pack, parking sensors",dublin
bmw x1 (23d),6091.00,11/10/2024,2012,122594,suv,manual,diesel,bmw x1. 2.0 23d se suv 5dr diesel manual xdrive euro 5 (s/s) (204 ps). 2 previous owners,kilkenny
bmw z4 (20i),36880.00,2024-10-13,2020,2119,convertible,automatic,petrol,blue bmw z4 series. z4 sdrive20i m sport 2.0 2dr. 2 previous owners,dublin
bmw x3 (20d),7715.00,2024-10-13,2013,153299,suv,automatic,diesel,black bmw x3. 2.0 20d se suv 5dr diesel auto xdrive euro 5 (s/s) (184 ps),cork
bmw m4 (biturbo),27165.00,13/10/2024,2015,64796,coupe,automatic,petrol,silver bmw m4. 3.0 biturbo dct euro 6 (s/s) 2dr. 3 previous owners,leitrim
bmw x5 (m sport),7421.00,14/10/2024,2009,130349,suv,automatic,diesel,blue bmw x5. 3.0 30d m sport suv 5dr diesel auto xdrive euro 4 (235 ps),dublin
bmw x1 (m sport),6293,14/10/2024,2011,81519,suv,manual,diesel,black bmw x1. 2.0 18d m sport xdrive euro 5 5dr. 5 previous owners,leitrim
bmw 2 series (sport),14169.00,2024-10-15,2018,66710,coupe,manual,diesel,black bmw 2 series. 218d sport coupe 2.0 2dr. 1 previous owner,mayo
bmw 5 series (540i),24499.00,15/10/2024,2019,69472,saloon,automatic,petrol,navy bmw 5 series. 3.0 540i gpf m sport saloon 4dr petrol auto xdrive euro 6 (s/s) (340 ps). 1 previous owner,dublin
bmw 1 series (m sport),6403.00,2024-10-17,2010,77421,convertible,manual,diesel,silver bmw 1 series. 2.0 118d m sport euro 5 2dr. 8 previous owners,cavan
bmw 1 series (118i),16148.00,20/10/2024,2017,27258,hatchback,automatic,petrol,black bmw 1 series. 1.5 118i sport auto euro 6 (s/s) 5dr,limerick
bmw z4 (m sport),36264.00,21/10/2024,2020,11529,convertible,automatic,petrol,blue bmw z4 series. z4 sdrive20i m sport 2.0 2dr. 1 previous owner,dublin
bmw 4 series (420d),38167.00,21/10/2024,2021,9700,convertible,automatic,diesel hybrid,navy bmw 4 series. 2.0 420d mht m sport auto euro 6 (s/s) 2dr. 2 previous owners,wicklow
bmw m4 (competition),39934.00,22/10/2024,2018,16680,coupe,automatic,petrol,navy bmw m4 series. m4 coupe competition package 3.0 2dr. 2 previous owners,dublin
bmw 2 series (218i),16250.00,22/10/2024,2018,26218,coupe,manual,petrol,blue bmw 2 series. 1.5 218i sport 2d 134 bhp alloys - bluetooth - air con,wexford
bmw 1 series (120d),21658.00,2024-10-23,2019,21002,hatchback,automatic,diesel,blue bmw 1 series. 120d m sport 5-door 2.0 5dr. 2 previous owners,galway
bmw x5 (mht),60400.00,23/10/2024,2021,12372,suv,automatic,diesel hybrid,blue bmw x5. 3.0 30d mht m sport auto xdrive euro 6 (s/s) 5dr. 1 previous owner,carlow
bmw x5 (sd),8194.00,24/10/2024,2009,111386,suv,automatic,diesel,black bmw x5. sd m sport 3.0 5dr. 4 previous owners,westmeath
bmw 1 series (m135i),32872.00,2024-10-24,2020,18586,hatchback,automatic,petrol,black bmw 1 series. m135i xdrive 2.0 5dr. 1 previous owner,meath
bmw 3 series (330d),22418.00,28/10/2024,2018,58940,saloon,automatic,diesel,silver bmw 3 series. 3.0 330d m sport shadow edition saloon 4dr diesel auto xdrive euro 6 (s/s) (258 ps),mayo
bmw m4 (competition m),69620.00,29/10/2024,2022,7505,coupe,automatic,petrol,red bmw m4 series. m4 competition m xdrive coupe 3.0 2dr. 1 previous owner,dublin
bmw x5 (m sport),32794.00,29/10/2024,2016,23074,suv,automatic,diesel,blue bmw x5. 3.0 40d m sport auto xdrive (s/s) 5dr,wexford
bmw 4 series (420d),7916.00,2024-10-30,2014,190101,coupe,automatic,diesel,black bmw 4 series. 2.0 420d m sport auto xdrive euro 6 (s/s) 2dr. 5 previous owners,longford
bmw 1 series (118d),26414.00,31/10/2024,2020,22825,hatchback,automatic,diesel,black bmw 1 series. 118d m sport 2.0 5dr. 2 previous owners,dublin
bmw i4 (m50),75185.00,01/11/2024,2022,915,hatchback,automatic,electric,blue bmw i4. m50 gran coupe auto 4wd 5dr 83.9kwh. 1 previous owner,dublin
bmw i3 (s),31179.00,01/11/2024,2020,3794,hatchback,automatic,electric,grey bmw i3 series. i3s 120ah 5dr. 1 previous owner,meath
bmw m4 (biturbo),38477.00,2024-11-02,2019,42217,coupe,automatic,petrol,red bmw m4 series. m4 coupe competition package 3.0 2dr. 1 previous owner,cork
bmw 4 series (420d),19155.00,06/11/2024,2017,63080,coupe,automatic,diesel,bmw 4 series. 420d xdrive m sport coupe 2.0 2dr. 1 previous owner,limerick
bmw 1 series (efficientdynamics business),7868.00,2024-11-06,2014,97085,hatchback,manual,diesel,silver bmw 1 series. 1.6 116d ed efficientdynamics business euro 5 (s/s) 5dr,westmeath
bmw 1 series (m sport shadow edition),20368.00,08/11/2024,2019,32139,hatchback,automatic,petrol,bmw 1 series. 118i [1.5] m sport shadow ed 5dr step auto. 1 previous owner,dublin
bmw 3 series (320d),8817.00,08/11/2024,2016,131131,saloon,automatic,diesel,navy bmw 3 series. 2.0 320d se auto euro 6 (s/s) 4dr,cavan
bmw 5 series (m sport),9906.00,2024-11-10,2011,98088,saloon,automatic,diesel,red bmw 5 series. 2.0 520d m sport saloon 4dr diesel steptronic euro 5 (184 ps),dublin
bmw 4 series gran coupe (420i),21916.00,11/11/2024,2018,28440,hatchback,automatic,petrol,silver bmw 4 series gran coupe. 2.0 420i gpf m sport auto euro 6 (s/s) 5dr. 2 previous owners,dublin
bmw 1 series (116d),10191.00,12/11/2024,2014,85392,hatchback,automatic,diesel,silver bmw 1 series. 2.0 116d m sport auto euro 5 (s/s) 5dr. 3 previous owners,kerry
bmw 1 series (m sport),12455.00,2024-11-12,2014,52420,hatchback,manual,diesel,black bmw 1 series. 2.0 120d xdrive m sport 5d 181 bhp finance available / p/x welcome,dublin
bmw 5 series (530e),44206.00,13/11/2024,2021,16242,saloon,automatic,petrol plug-in hybrid,blue bmw 5 series. 2.0 530e 12kwh m sport steptronic euro 6 (s/s) 4dr,kildare
bmw z4 (highline edition),12119.00,2024-11-13,2011,32733,convertible,manual,petrol,silver bmw z4. 2.5 23i highline edition sdrive euro 5 2dr. 4 previous owners,laois
bmw 1 series (shadow edition),26582.00,15/11/2024,2018,23983,hatchback,automatic,petrol,blue bmw 1 series. m140i shadow edition 5-door 3.0 5dr. 1 previous owner,laois
bmw 1 series (116d),11475.00,2024-11-16,2016,71124,hatchback,manual,diesel,blue bmw 1 series. 1.5 116d ed plus euro 6 (s/s) 5dr,wicklow
bmw 5 series (m sport),8154,2024-11-16,2011,89313,saloon,automatic,diesel,red bmw 5 series. 2.0 520d m sport saloon 4dr diesel steptronic euro 5 (184 ps). 2 previous owners,carlow
bmw 3 series (mht),40405.00,16/11/2024,2021,6132,saloon,automatic,diesel hybrid,black bmw 3 series. 320d m sport pro edition saloon 2.0 4dr. 2 previous owners,meath
bmw x3 (m sport),30759.00,18/11/2024,2019,27384,suv,automatic,diesel,bmw x3. 2.0 20d m sport suv 5dr diesel auto xdrive euro 6 (s/s) (190 ps) - sports s,waterford
bmw 1 series (m135i),20853.00,2024-11-19,2015,36000,hatchback,automatic,petrol,red bmw 1 series. 3.0 m135i auto euro 6 (s/s) 5dr. 3 previous owners,westmeath
bmw x4 (35d),21878.00,19/11/2024,2015,77314,suv,automatic,diesel,black bmw x4. 3.0 35d m sport auto xdrive euro 6 (s/s) 5dr,dublin
bmw 4 series (m440i),50463.00,21/11/2024,2021,3366,convertible,automatic,petrol hybrid,navy bmw 4 series. m440i xdrive convertible 3.0 2dr. 2 previous owners,cork
bmw 2 series (218d),11845.00,23/11/2024,2015,130500,coupe,manual,diesel,silver bmw 2 series. 2.0 218d m sport (s/s) 2dr. 1 previous owner,kerry
bmw x1 (20d),17831.00,24/11/2024,2016,36885,suv,manual,diesel,blue bmw x1. xdrive 20d xline 5dr 2.0,cork
bmw 2 series (218d),10745.00,25/11/2024,2015,53389,coupe,manual,diesel,red bmw 2 series. 218d se 2.0 2dr. 2 previous owners,clare
bmw 4 series (430d),13783.00,28/11/2024,2014,99757,coupe,automatic,diesel,red bmw 4 series. 430d xdrive m sport 3.0 2dr,kildare
bmw 5 series (520d),15163.00,2024-11-28,2014,57255,saloon,automatic,diesel,navy bmw 5 series. 2.0 520d m sport 4d 181 bhp,offaly
bmw m3 (v8),20064.00,29/11/2024,2013,65959,convertible,automatic,petrol,bmw m3. 4.0 v8 limited edition 500 dct euro 5 2dr. 5 previous owners,galway
bmw 1 series (118i),9130.00,01/12/2024,2016,95109,hatchback,manual,petrol,black bmw 1 series. 1.5 118i sport euro 6 (s/s) 5dr,dublin
bmw 1 series (116d),12173.00,2024-12-01,2015,50174,hatchback,manual,diesel,red bmw 1 series. 1.5 116d m sport euro 6 (s/s) 3dr,dublin
bmw 3 series (320d),8153.00,2024-12-01,2013,104028,estate,automatic,diesel,black bmw 3 series. 2.0 320d luxury touring auto euro 5 (s/s) 5dr. 4 previous owners,kerry
bmw 4 series (420d),16137.00,02/12/2024,2016,68192,coupe,automatic,diesel,bmw 4 series diesel coupe. m sport euro6 d automatic coupe leather navigation ghost security 2.0 2dr. 2 previous owners,louth
bmw 1 series (m sport),11638.00,03/12/2024,2013,55273,hatchback,automatic,diesel,blue bmw 1 series. 2.0 120d m sport 3d 181 bhp zero deposit finance available,westmeath
bmw 3 series (318d),2842.00,03/12/2024,2011,188292,saloon,manual,diesel,red bmw 3 series. 2.0 318d m sport euro 5 (s/s) 4dr. 2 previous owners,wexford
bmw x5 (m50i v8),60289.00,03/12/2024,2020,32278,suv,automatic,petrol,red bmw x5. xdrive m50i 5dr auto 4.4,dublin
bmw 1 series (se),9007,05/12/2024,2013,72887,convertible,automatic,diesel,blue bmw 1 series. 2.0 118d se auto euro 5 2dr,louth
bmw 2 series (218i),21865.00,07/12/2024,2020,20098,coupe,automatic,petrol,navy bmw 2 series. 218i m sport 2dr [nav] step auto 1.5. 1 previous owner,meath
bmw 4 series gran coupe (430d),13341.00,10/12/2024,2016,87422,hatchback,automatic,diesel,black bmw 4 series gran coupe. 3.0 430d m sport auto xdrive euro 6 (s/s) 5dr. 4 previous owners,louth
bmw m4 (biturbo),71409.00,11/12/2024,2021,5550,convertible,automatic,petrol,red bmw 4 series. 2021 71 bmw m4 3.0 competition m xdrive convertible 2dr,dublin
bmw m5 (v8),52116.00,11/12/2024,2019,29884,saloon,automatic,petrol,blue bmw m5. 4.4 v8 steptronic xdrive euro 6 (s/s) 4dr. 1 previous owner,waterford
bmw z4 (20i),11409.00,12/12/2024,2012,56435,convertible,automatic,petrol,bmw z4. 2.0 20i auto sdrive euro 5 2dr. 5 previous owners,kerry
bmw 3 series (mht),41463.00,13/12/2024,2021,16980,saloon,automatic,petrol hybrid,silver bmw 3 series. m340i xdrive saloon 3.0 4dr. 1 previous owner,cork
bmw 1 series (116d),26481.00,13/12/2024,2020,10608,hatchback,automatic,diesel,black bmw 1 series. 1.5 116d m sport dct euro 6 (s/s) 5dr. 2 previous owners,wexford
bmw 3 series (m sport),10161.00,14/12/2024,2014,108186,saloon,manual,diesel,black bmw 3 series. 318d m sport 2.0 4dr,tipperary
bmw 3 series (luxury),14862.00,14/12/2024,2014,60485,saloon,automatic,petrol hybrid,blue bmw 3 series. 3.0 activehybrid 3 luxury 4d 302 bhp professional navigation system+aux,cork
bmw x2 (20d),25819.00,15/12/2024,2018,23022,suv,automatic,diesel,grey bmw x2 series. x2 xdrive20d m sport 2.0 5dr. 2 previous owners,meath
bmw 1 series (sport),2408.00,16/12/2024,2009,166530,hatchback,manual,diesel,black bmw 1 series. 2.0 116d sport hatchback 3dr diesel manual euro 4 (116 ps). 3 previous owners,galway
bmw m3 (monte carlo),27189.00,17/12/2024,2010,79048,coupe,auto,petrol,navy bmw m3. 4.0 iv8 monte carlo dct euro 4 2dr,dublin
bmw 1 series (sport),6708.00,19/12/2024,2013,80156,hatchback,manual,petrol,silver bmw 1 series. 114 sport 1.6 3dr. 5 previous owners,dublin
bmw 7 series (730ld),30182.00,19/12/2024,2017,62343,saloon,automatic,diesel,black bmw 7 series. 3.0 730ld m sport auto euro 6 (s/s) 4dr. 4 previous owners,cavan
bmw 1 series (116d),7203.00,2024-12-19,2015,135133,hatchback,manual,diesel,bmw 1 series. 1.5 116d ed plus euro 6 (s/s) 5dr. 5 previous owners,limerick
bmw 1 series (118d),10324.00,2024-12-21,2017,72293,hatchback,manual,diesel,silver bmw 1 series. 2.0 118d sport euro 6 (s/s) 5dr. 2 previous owners,dublin
bmw 1 series (118d),7576.00,2024-12-21,2012,105724,hatchback,manual,diesel,blue bmw 1 series. 2.0 118d m sport euro 5 (s/s) 5dr. 2 previous owners,galway
bmw 1 series (120d),15463.00,22/12/2024,2016,53815,hatchback,auto,diesel,bmw 1 series. 120d xdrive m sport 2.0 5dr,monaghan
